drop table if exists test_11;
create table test_11 (c int primary key,d int);
Insert into test_11 values(1,1);
Insert into test_11 values(2,2);
begin;
Insert into test_11 values(3,1);
Insert into test_11 values(4,2);
select * from test_11;
c	d
3	1
4	2
1	1
2	2
use isolation_1;
begin;
begin txn in the began txn
select * from test_11;
c	d
1	1
2	2
commit;
the txn has not been began
select * from test_11;
c	d
1	1
2	2
commit;
the txn has not been began
select * from test_11;
c	d
1	1
2	2
drop table if exists test_11;
create table test_11 (c int primary key,d int);
Insert into test_11 values(1,1);
Insert into test_11 values(2,2);
begin;
Insert into test_11 values(3,1);
Insert into test_11 values(4,2);
select * from test_11;
c	d
1	1
2	2
3	1
4	2
begin;
begin txn in the began txn
select * from test_11;
c	d
1	1
2	2
delete from test_11 where c =1;
select * from test_11;
c	d
2	2
select * from test_11;
c	d
2	2
update test_11 set d = c +1 where c > 2;
select * from test_11;
c	d
2	2
select * from test_11;
c	d
2	2
commit;
the txn has not been began
select * from test_11;
c	d
2	2
commit;
the txn has not been began
select * from test_11;
c	d
2	2
drop table if exists test_11;
begin;
create table test_11 (c int primary key,d int);
Insert into test_11 values(1,1);
Insert into test_11 values(2,2);
select * from test_11;
c	d
1	1
2	2
begin;
begin txn in the began txn
select * from test_11;
table "test_11" does not exist
commit;
the txn has not been began
select * from test_11;
table "test_11" does not exist
commit;
the txn has not been began
select * from test_11;
table "test_11" does not exist
drop table if exists test_11;
create table test_11 (c int primary key,d int);
tae txn: w-w conflict error
Insert into test_11 values(1,1);
tae catalog: not found
Insert into test_11 values(2,2);
tae catalog: not found
begin;
Insert into test_11 values(3,1);
tae catalog: not found
Insert into test_11 values(4,2);
tae catalog: not found
select * from test_11;
table "test_11" does not exist
begin;
begin txn in the began txn
select * from test_11;
table "test_11" does not exist
Insert into test_11 values(5,4);
tae catalog: not found
select * from test_11;
table "test_11" does not exist
select * from test_11;
table "test_11" does not exist
Insert into test_11 values(50,50);
tae catalog: not found
Insert into test_11 values(51,50);
tae catalog: not found
select * from test_11;
table "test_11" does not exist
select * from test_11;
table "test_11" does not exist
commit;
the txn has not been began
commit;
the txn has not been began
select * from test_11;
table "test_11" does not exist
select * from test_11;
table "test_11" does not exist
drop table if exists test_11;
create table test_11 (c int primary key,d int);
tae txn: w-w conflict error
Insert into test_11 values(1,1);
tae catalog: not found
Insert into test_11 values(2,2);
tae catalog: not found
begin;
Insert into test_11 values(3,1);
tae catalog: not found
Insert into test_11 values(4,2);
tae catalog: not found
select * from test_11;
table "test_11" does not exist
begin;
begin txn in the began txn
select * from test_11;
table "test_11" does not exist
Insert into test_11 values(5,4);
tae catalog: not found
select * from test_11;
table "test_11" does not exist
select * from test_11;
table "test_11" does not exist
Insert into test_11 values(50,50);
tae catalog: not found
Insert into test_11 values(50,50);
tae catalog: not found
select * from test_11;
table "test_11" does not exist
select * from test_11;
table "test_11" does not exist
commit;
the txn has not been began
commit;
the txn has not been began
select * from test_11;
table "test_11" does not exist
select * from test_11;
table "test_11" does not exist
drop table if exists test_11;
create table test_11 (c int primary key,d int);
tae txn: w-w conflict error
Insert into test_11 values(1,1);
tae catalog: not found
Insert into test_11 values(2,2);
tae catalog: not found
begin;
select * from test_11;
table "test_11" does not exist
Insert into test_11 values(50,50);
tae catalog: not found
select * from test_11;
table "test_11" does not exist
begin;
begin txn in the began txn
select * from test_11;
table "test_11" does not exist
Insert into test_11 values(50,50);
tae catalog: not found
select * from test_11;
table "test_11" does not exist
select * from test_11;
table "test_11" does not exist
delete from test_11 where c = 50;
cannot find delete table
select * from test_11;
table "test_11" does not exist
select * from test_11;
table "test_11" does not exist
commit;
the txn has not been began
commit;
the txn has not been began
select * from test_11;
table "test_11" does not exist
select * from test_11;
table "test_11" does not exist
drop table if exists test_11;
create table test_11 (c int primary key,d int);
tae txn: w-w conflict error
Insert into test_11 values(1,1);
tae catalog: not found
Insert into test_11 values(2,2);
tae catalog: not found
begin;
select * from test_11;
table "test_11" does not exist
Insert into test_11 values(50,50);
tae catalog: not found
select * from test_11;
table "test_11" does not exist
begin;
begin txn in the began txn
select * from test_11;
table "test_11" does not exist
Insert into test_11 values(50,50);
tae catalog: not found
select * from test_11;
table "test_11" does not exist
select * from test_11;
table "test_11" does not exist
select * from test_11;
table "test_11" does not exist
update test_11 set c = 100 where d = 50;
cannot find update table
select * from test_11;
table "test_11" does not exist
select * from test_11;
table "test_11" does not exist
Insert into test_11 values(100,50);
tae catalog: not found
commit;
the txn has not been began
commit;
the txn has not been began
select * from test_11;
table "test_11" does not exist
select * from test_11;
table "test_11" does not exist
drop table if exists test_11;
create table test_11 (c int primary key,d int);
tae txn: w-w conflict error
Insert into test_11 values(1,1);
tae catalog: not found
Insert into test_11 values(2,2);
tae catalog: not found
begin;
select * from test_11;
table "test_11" does not exist
Insert into test_11 values(50,50);
tae catalog: not found
select * from test_11;
table "test_11" does not exist
begin;
begin txn in the began txn
select * from test_11;
table "test_11" does not exist
Insert into test_11 values(50,50);
tae catalog: not found
select * from test_11;
table "test_11" does not exist
select * from test_11;
table "test_11" does not exist
select * from test_11;
table "test_11" does not exist
update test_11 set c = 100 where d = 50;
cannot find update table
select * from test_11;
table "test_11" does not exist
select * from test_11;
table "test_11" does not exist
update test_11 set c = 101 where c = 50;
cannot find update table
commit;
the txn has not been began
commit;
the txn has not been began
select * from test_11;
table "test_11" does not exist
select * from test_11;
table "test_11" does not exist
drop table if exists test_11;
create table test_11 (c int primary key,d int);
tae txn: w-w conflict error
Insert into test_11 values(1,1);
tae catalog: not found
Insert into test_11 values(2,2);
tae catalog: not found
begin;
select * from test_11;
table "test_11" does not exist
Insert into test_11 values(50,50);
tae catalog: not found
select * from test_11;
table "test_11" does not exist
begin;
begin txn in the began txn
select * from test_11;
table "test_11" does not exist
Insert into test_11 values(50,50);
tae catalog: not found
select * from test_11;
table "test_11" does not exist
select * from test_11;
table "test_11" does not exist
select * from test_11;
table "test_11" does not exist
update test_11 set c = 100 where d = 50;
cannot find update table
select * from test_11;
table "test_11" does not exist
select * from test_11;
table "test_11" does not exist
update test_11 set c = 100 where d = 50;
cannot find update table
commit;
the txn has not been began
commit;
the txn has not been began
select * from test_11;
table "test_11" does not exist
select * from test_11;
table "test_11" does not exist
drop table if exists test_11;
begin;
create table test_11 (c int primary key,d int);
tae txn: w-w conflict error
Insert into test_11 values(1,1);
tae catalog: not found
Insert into test_11 values(2,2);
tae catalog: not found
select * from test_11;
table "test_11" does not exist
begin;
begin txn in the began txn
select * from test_11;
table "test_11" does not exist
commit;
the txn has not been began
select * from test_11;
table "test_11" does not exist
commit;
the txn has not been began
select * from test_11;
table "test_11" does not exist
drop table if exists test_11;
create table test_11 (c int primary key,d int);
tae txn: w-w conflict error
Insert into test_11 values(1,1);
tae catalog: not found
Insert into test_11 values(2,2);
tae catalog: not found
select * from test_11;
table "test_11" does not exist
begin;
select * from test_11;
table "test_11" does not exist
begin;
begin txn in the began txn
drop table test_11;
tae catalog: not found
select * from test_11;
table "test_11" does not exist
select * from test_11;
table "test_11" does not exist
commit;
the txn has not been began
select * from test_11;
table "test_11" does not exist
commit;
the txn has not been began
select * from test_11;
table "test_11" does not exist
drop table if exists test_11;
begin;
create table test_11 (c int primary key,d int);
tae txn: w-w conflict error
Insert into test_11 values(1,1);
tae catalog: not found
Insert into test_11 values(2,2);
tae catalog: not found
select * from test_11;
table "test_11" does not exist
begin;
begin txn in the began txn
select * from test_11;
table "test_11" does not exist
select * from test_11;
table "test_11" does not exist
select * from test_11;
table "test_11" does not exist
commit;
the txn has not been began
select * from test_11;
table "test_11" does not exist
commit;
the txn has not been began
select * from test_11;
table "test_11" does not exist
drop table if exists test_11;
