select 0,256,00000000000000065536,2147483647,-2147483648,2147483648,+4294967296;
0	256	00000000000000065536	2147483647	-2147483648	2147483648	4294967296
0	256	65536	2147483647	-2147483648	2147483648	4294967296
select 9223372036854775807,-009223372036854775808;
9223372036854775807	-009223372036854775808
9223372036854775807	-9223372036854775808
select +9999999999999999999,-9999999999999999999;
9999999999999999999	-9999999999999999999
9999999999999999999	-9999999999999999999
select cast(9223372036854775808 as unsigned)+1;
cast(9223372036854775808 as unsigned)+1
9223372036854775809
select 9223372036854775808+1;
9223372036854775808+1
9223372036854775809
select -(0-3),round(-(0-3)), round(9999999999999999999);
-(0-3)	round(-(0-3))	round(9999999999999999999)
3	3	9999999999999999999
select 1,11,101,1001,10001,100001,1000001,10000001,100000001,1000000001,10000000001,100000000001,1000000000001,10000000000001,100000000000001,1000000000000001,10000000000000001,100000000000000001,1000000000000000001,10000000000000000001;
1	11	101	1001	10001	100001	1000001	10000001	100000001	1000000001	10000000001	100000000001	1000000000001	10000000000001	100000000000001	1000000000000001	10000000000000001	100000000000000001	1000000000000000001	10000000000000000001
1	11	101	1001	10001	100001	1000001	10000001	100000001	1000000001	10000000001	100000000001	1000000000001	10000000000001	100000000000001	1000000000000001	10000000000000001	100000000000000001	1000000000000000001	10000000000000000001
select -1,-11,-101,-1001,-10001,-100001,-1000001,-10000001,-100000001,-1000000001,-10000000001,-100000000001,-1000000000001,-10000000000001,-100000000000001,-1000000000000001,-10000000000000001,-100000000000000001,-1000000000000000001,-10000000000000000001;
-1	-11	-101	-1001	-10001	-100001	-1000001	-10000001	-100000001	-1000000001	-10000000001	-100000000001	-1000000000001	-10000000000001	-100000000000001	-1000000000000001	-10000000000000001	-100000000000000001	-1000000000000000001	-10000000000000000001
-1	-11	-101	-1001	-10001	-100001	-1000001	-10000001	-100000001	-1000000001	-10000000001	-100000000001	-1000000000001	-10000000000001	-100000000000001	-1000000000000001	-10000000000000001	-100000000000000001	-1000000000000000001	-10000000000000000001
create table t1 (a bigint unsigned not null, primary key(a));
insert into t1 values (18446744073709551615), (0xFFFFFFFFFFFFFFFE), (18446744073709551613), (18446744073709551612);
select * from t1;
a
18446744073709551612
18446744073709551613
18446744073709551614
18446744073709551615
select * from t1 where a=18446744073709551615;
a
18446744073709551615
delete from t1 where a=18446744073709551615;
select * from t1;
a
18446744073709551612
18446744073709551613
18446744073709551614
drop table t1;
create table t1 ( a int not null default 1, big bigint );
insert into t1 (big) values (-1),(12345678901234567),(9223372036854775807);
select * from t1;
a	big
1	-1
1	12345678901234567
1	9223372036854775807
select min(big),max(big),max(big)-1 from t1;
min(big)	max(big)	max(big)-1
-1	9223372036854775807	9223372036854775806
select min(big),max(big),max(big)-1 from t1 group by a;
min(big)	max(big)	max(big)-1
-1	9223372036854775807	9223372036854775806
drop table t1;
create table t1 ( a int not null default 1, big bigint unsigned);
insert into t1 (big) values (0),(18446744073709551615), (0xFFFFFFFFFFFFFFFE), (18446744073709551613), (18446744073709551612);
select * from t1;
a	big
1	0
1	18446744073709551615
1	18446744073709551614
1	18446744073709551613
1	18446744073709551612
select min(big),max(big),max(big)-1 from t1;
min(big)	max(big)	max(big)-1
0	18446744073709551615	18446744073709551614
select min(big),max(big),max(big)-1 from t1 group by a;
min(big)	max(big)	max(big)-1
0	18446744073709551615	18446744073709551614
drop table t1;
create table t1 (id bigint auto_increment primary key, a int) auto_increment=9999999999;
insert into t1 values (null,1);
select * from t1;
id	a
9999999999	1
select * from t1 limit 9999999999;
id	a
9999999999	1
drop table if exists t1,t2;
create table t1 (
value64  bigint unsigned  not null,
value32  integer          not null,
primary key(value64, value32)
);
create table t2 (
value64  bigint unsigned  not null,
value32  integer          not null,
primary key(value64, value32)
);
insert into t1 values(17156792991891826145, 1);
insert into t1 values( 9223372036854775807, 2);
insert into t2 values(17156792991891826145, 3);
insert into t2 values( 9223372036854775807, 4);
select * from t1;
value64	value32
9223372036854775807	2
17156792991891826145	1
select * from t2;
value64	value32
9223372036854775807	4
17156792991891826145	3
select * from t1 join t2 on t1.value64=t2.value64;
value64	value32	value64	value32
9223372036854775807	2	9223372036854775807	4
17156792991891826145	1	17156792991891826145	3
select * from t1 join t2 on t1.value64=t2.value64 where t1.value64=17156792991891826145;
value64	value32	value64	value32
17156792991891826145	1	17156792991891826145	3
drop table t1, t2;
create table t1 (sint64 bigint not null);
insert into t1 values (-9223372036854775808);
select * from t1;
sint64
-9223372036854775808
DROP TABLE t1;
create table t1 (bigint_col bigint unsigned);
insert into t1 values (17666000000000000000);
select * from t1 where bigint_col=17666000000000000000;
bigint_col
17666000000000000000
select * from t1 where bigint_col='17666000000000000000';
bigint_col
17666000000000000000
drop table t1;
select cast(10000002383263201056 as unsigned) mod 50 as result;
result
6
select cast(19999999999999999999 as signed);
cast(19999999999999999999 as signed)
9223372036854775807
select cast(-19999999999999999999 as signed);
cast(-19999999999999999999 as signed)
-9223372036854775808
CREATE TABLE t1 (id INT AUTO_INCREMENT PRIMARY KEY,
a BIGINT(20) UNSIGNED,
b VARCHAR(20));
INSERT INTO t1 (a) VALUES
(0),
(CAST(0x7FFFFFFFFFFFFFFF AS UNSIGNED)),
(CAST(0x8000000000000000 AS UNSIGNED)),
(CAST(0xFFFFFFFFFFFFFFFF AS UNSIGNED));
UPDATE t1 SET b = a;
select * from t1 where ((a = 18446744073709551615) and (b = '18446744073709551615'));
id	a	b
4	18446744073709551615	18446744073709551615
CREATE TABLE t_bigint(id BIGINT);
INSERT INTO t_bigint VALUES (1), (2);
SELECT id, id >= 1.1 FROM t_bigint;
id	id >= 1.1
1	0
2	1
SELECT id, 1.1 <= id FROM t_bigint;
id	1.1 <= id
1	0
2	1
SELECT id, id = 1.1 FROM t_bigint;
id	id = 1.1
1	0
2	0
SELECT id, 1.1 = id FROM t_bigint;
id	1.1 = id
1	0
2	0
SELECT * from t_bigint WHERE id = 1.1;
id
SELECT * from t_bigint WHERE id = 1.1e0;
id
SELECT * from t_bigint WHERE id = '1.1';
id
SELECT * from t_bigint WHERE id = '1.1e0';
id
SELECT * from t_bigint WHERE id IN (1.1, 2.2);
id
SELECT * from t_bigint WHERE id IN (1.1e0, 2.2e0);
id
SELECT * from t_bigint WHERE id IN ('1.1', '2.2');
id
SELECT * from t_bigint WHERE id IN ('1.1e0', '2.2e0');
id
SELECT * from t_bigint WHERE id BETWEEN 1.1 AND 1.9;
id
SELECT * from t_bigint WHERE id BETWEEN 1.1e0 AND 1.9e0;
id
SELECT * from t_bigint WHERE id BETWEEN '1.1' AND '1.9';
id
SELECT * from t_bigint WHERE id BETWEEN '1.1e0' AND '1.9e0';
id
DROP TABLE t1;
CREATE TABLE t1 (a BIGINT);
INSERT INTO t1 VALUES (1);
SELECT * FROM t1 WHERE coalesce(a) BETWEEN 0 and 0.9;
a
SELECT * FROM t1 WHERE coalesce(a)=0.9;
a
SELECT * FROM t1 WHERE coalesce(a) in (0.8,0.9);
a
SELECT * FROM t1 WHERE a BETWEEN 0 AND 0.9;
a
SELECT * FROM t1 WHERE a=0.9;
a
SELECT * FROM t1 WHERE a IN (0.8,0.9);
a
DROP TABLE t1;
create table t (id bigint unsigned, b int);
insert into t values(8894754949779693574,1);
insert into t values(8894754949779693579,2);
insert into t values(17790886498483827171,3);
select count(*) from t
where id>=8894754949779693574 and id <=17790886498483827171;
count(*)
3
select count(*) from t
where id between 8894754949779693574 and 17790886498483827171;
count(*)
3
drop table t;
SELECT (184467440737095 BETWEEN 0 AND 18446744073709551500);
(184467440737095 BETWEEN 0 AND 18446744073709551500)
1
SELECT 184467440737095 >= 0;
184467440737095 >= 0
1
SELECT 0 <= 18446744073709551500;
0 <= 18446744073709551500
1
SELECT CAST(100 AS UNSIGNED) BETWEEN 1 AND -1;
CAST(100 AS UNSIGNED) BETWEEN 1 AND -1
0
SELECT CAST(100 AS UNSIGNED) NOT BETWEEN 1 AND -1;
CAST(100 AS UNSIGNED) NOT BETWEEN 1 AND -1
1
SELECT CAST(0 AS UNSIGNED) BETWEEN 0 AND -1;
CAST(0 AS UNSIGNED) BETWEEN 0 AND -1
0
SELECT CAST(0 AS UNSIGNED) NOT BETWEEN 0 AND -1;
CAST(0 AS UNSIGNED) NOT BETWEEN 0 AND -1
1
SELECT ( 9223372036854775808 BETWEEN 9223372036854775808 AND 9223372036854775808 );
( 9223372036854775808 BETWEEN 9223372036854775808 AND 9223372036854775808 )
1
SELECT ( 9223372036854775807 BETWEEN 9223372036854775808 AND 1 );
( 9223372036854775807 BETWEEN 9223372036854775808 AND 1 )
0
SELECT ( -1 BETWEEN 9223372036854775808 AND 1 );
( -1 BETWEEN 9223372036854775808 AND 1 )
0
SELECT ( 0 BETWEEN 9223372036854775808 AND 1 );
( 0 BETWEEN 9223372036854775808 AND 1 )
0
SELECT ( 1 BETWEEN 9223372036854775808 AND 1 );
( 1 BETWEEN 9223372036854775808 AND 1 )
0
