select cast('0000-01-01' as date),cast('0000-01-01' as date)-1;
cast('0000-01-01' as date)	cast('0000-01-01' as date)-1
0000-01-01	100
select cast('2000-1-1' as date);
cast('2000-1-1' as date)
2000-01-01
select cast('200-01-1' as date);
cast('200-01-1' as date)
0200-01-01
select cast('2021-02-29' as date);
cast('2021-02-29' as date)
NULL
select cast('2022-02-01' as date)-cast('2022-01-01' as date);
cast('2022-02-01' as date)-cast('2022-01-01' as date)
100
select cast('2020-02-01' as date)+NULL;
cast('2020-02-01' as date)+NULL
NULL
select cast('0000-00-00' as date);
cast('0000-00-00' as date)
NULL
select cast(cast(0x13488c5 as signed) as date);
cast(cast(0x13488c5 as signed) as date)
2022-01-01
SELECT DATE_ADD("2017-06-15", INTERVAL 10 DAY);
DATE_ADD("2017-06-15", INTERVAL 10 DAY)
2017-06-25
SELECT DATE_ADD("2017-06-15", INTERVAL -10 MONTH);
DATE_ADD("2017-06-15", INTERVAL -10 MONTH)
2016-08-15
SELECT DATE_ADD("2017-06-15", INTERVAL -2018 YEAR);
DATE_ADD("2017-06-15", INTERVAL -2018 YEAR)
NULL
SELECT DATE_ADD(20200215, INTERVAL 14 DAY);
DATE_ADD(20200215, INTERVAL 14 DAY)
2020-02-29
drop table if exists t1;
create table t1 (a date not null, primary key(a));
insert into t1 values ('2022-01-01'), ('20220102'),("2022-01-03"),(20220104);
select * from t1;
a
2022-01-01
2022-01-02
2022-01-03
2022-01-04
select * from t1 where a='2022-01-01';
a
2022-01-01
delete from t1 where a=20220102;
select * from t1 where a<>"20220104";
a
2022-01-01
2022-01-03
update t1 set a='2022-02-02' where a="2022-01-03";
select * from t1;
a
2022-01-01
2022-01-04
2022-02-02
drop table t1;
create table t1 ( a int not null default 1, big date );
insert into t1 (big) values ('2000-01-01'),('2001-01-01'),('2000-01-01');
select * from t1;
a	big
1	2000-01-01
1	2001-01-01
1	2000-01-01
select distinct big from t1 where big=20000101;
big
2000-01-01
select min(big),max(big),max(big)-1 from t1;
min(big)	max(big)	max(big)-1
2000-01-01	2001-01-01	20010100
select min(big),avg(big),count(big)+1 from t1 group by big;
min(big)	avg(big)	count(big)+1
2000-01-01	20000101.0000	3
2001-01-01	20010101.0000	2
drop table t1;
create table t1 (id date not null default "2022-01-31", a int, primary key (a));
insert into t1(a) values (1);
select * from t1;
id	a
2022-01-31	1
drop table if exists t1,t2;
create table t1 (
dvalue  date not null,
value32  integer not null,
primary key(dvalue)
);
create table t2 (
dvalue  date not null,
value32  integer not null,
primary key(dvalue)
);
insert into t1 values('2022-01-01', 1);
insert into t1 values('2022-01-02', 2);
insert into t2 values('2022-01-03', 3);
insert into t2 values('2022-01-02', 4);
insert into t2 values('2022-01-01', 5);
select * from t1;
dvalue	value32
2022-01-01	1
2022-01-02	2
select * from t2;
dvalue	value32
2022-01-01	5
2022-01-02	4
2022-01-03	3
select * from t1 join t2 on t1.dvalue=t2.dvalue;
dvalue	value32	dvalue	value32
2022-01-01	1	2022-01-01	5
2022-01-02	2	2022-01-02	4
select * from t1 join t2 on t1.dvalue=t2.dvalue where t1.dvalue>='2022-01-01' group by t1.dvalue order by t2.dvalue;
dvalue	value32	dvalue	value32
2022-01-01	1	2022-01-01	5
2022-01-02	2	2022-01-02	4
drop table if exists t1, t2;
CREATE TABLE t_date(id date);
INSERT INTO t_date VALUES ('2020-01-01'), ('2022-01-02');
SELECT id, id >= 20200102 FROM t_date;
id	id >= 20200102
2020-01-01	0
2022-01-02	1
SELECT id, 1.1 <= '2020-01-01' FROM t_date;
id	1.1 <= '2020-01-01'
2020-01-01	1
2022-01-02	1
SELECT id, id = 202020101 FROM t_date;
id	id = 202020101
2020-01-01	0
2022-01-02	0
SELECT id, 20200101 = id FROM t_date;
id	20200101 = id
2020-01-01	1
2022-01-02	0
SELECT * from t_date WHERE id = 20200101;
id
2020-01-01
SELECT * from t_date WHERE id = 2.0200101e7;
id
2020-01-01
SELECT * from t_date WHERE id = '20200101';
id
2020-01-01
SELECT * from t_date WHERE id IN ('2020-01-01','2022-01-03');
id
2020-01-01
SELECT * from t_date WHERE id IN (2.0200101e7,2.0200103e7 );
id
2020-01-01
SELECT * from t_date WHERE id IN (20220101, 20220103);
id
SELECT * from t_date WHERE id IN ('2.0200101e7','2.0200103e7');
id
SELECT * from t_date WHERE id BETWEEN 20191231 AND 20200101;
id
2020-01-01
SELECT * from t_date WHERE id BETWEEN 2.0200101e7 and 2.0200103e7;
id
2020-01-01
SELECT * from t_date WHERE id BETWEEN '2020-01-02' AND '2020-01-03';
id
SELECT * from t_date WHERE id BETWEEN '2.0200101e7' and '2.0200103e7';
id
DROP TABLE if exists t1;
CREATE TABLE t1 (a date);
INSERT INTO t1 VALUES ("2022-03-01");
SELECT * FROM t1 WHERE coalesce(a) BETWEEN '2022-02-28' and '2022-03-01';
a
2022-03-01
SELECT * FROM t1 WHERE coalesce(a)=20220301;
a
2022-03-01
SELECT * FROM t1 WHERE coalesce(a) in ('2022-02-28','2022-03-01');
a
2022-03-01
DROP TABLE t1;
SELECT CAST(20220101 AS date) BETWEEN 20220101 AND -1;
CAST(20220101 AS date) BETWEEN 20220101 AND -1
0
SELECT CAST(00000501 AS date) NOT BETWEEN 100 AND -1;
CAST(00000501 AS date) NOT BETWEEN 100 AND -1
1
SELECT CAST(0 AS date) BETWEEN 0 AND -1;
CAST(0 AS date) BETWEEN 0 AND -1
NULL
SELECT CAST(10000101 as date) BETWEEN '1000-01-01' and '1000-01-02';
CAST(10000101 as date) BETWEEN '1000-01-01' and '1000-01-02'
1
