select 0.00,1.11,1234567890.1234567890123456789;
0.00	1.11	1234567890.1234567890123456789
0.00	1.11	1234567890.1234567890123456789
select 1123.2333+1233.3331;
1123.2333+1233.3331
2356.5664
select cast(9223372.036854775808 as decimal)+1;
cast(9223372.036854775808 as decimal)+1
9223373
select round(cast(2320310.66666612312 as decimal));
round(cast(2320310.66666612312 as decimal))
2320311
select floor(cast(2231231.501231 as decimal));
floor(cast(2231231.501231 as decimal))
2231232
drop table if exists t1;
create table t1 (a decimal(29,0) not null, primary key(a));
insert into t1 values (18446744073709551615), (0xFFFFFFFFFFFFFE), (18446744073709551613.0000000), (18446744073709551612.0000000001);
select * from t1;
a
72057594037927934
18446744073709551612
18446744073709551613
18446744073709551615
select * from t1 where a=18446744073709551615;
a
18446744073709551615
delete from t1 where a=18446744073709551615.000000000;
select * from t1;
a
72057594037927934
18446744073709551612
18446744073709551613
drop table t1;
create table t1 ( a int not null default 1, big decimal(29,11) );
insert into t1 (big) values (-1),(12.34567891234567),(92.23372036854775807);
select * from t1;
a	big
1	-1.00000000000
1	12.34567891235
1	92.23372036855
select min(big),max(big),max(big)-1 from t1;
min(big)	max(big)	max(big)-1
-1.00000000000	92.23372036855	91.23372036855
select min(big),avg(big),max(big)-1 from t1 group by a;
min(big)	avg(big)	max(big)-1
-1.00000000000	34.526466426966667	91.23372036855
drop table t1;
create table t1 ( a int not null default 1, big decimal(20,4) primary key);
insert into t1 (big) values (0),(18446744073), (0xFFFFFE), (184467.13), (184462);
select * from t1 order by 2 desc;
a	big
1	18446744073.0000
1	16777214.0000
1	184467.1300
1	184462.0000
1	0.0000
select * from t1 order by big limit 1,2;
a	big
1	184462.0000
1	184467.1300
select * from t1 order by big limit 2 offset 1;
a	big
1	184462.0000
1	184467.1300
select min(big),max(big),max(big)-1 from t1;
min(big)	max(big)	max(big)-1
0.0000	18446744073.0000	18446744072.0000
select min(big),count(big),max(big)-1 from t1 group by a;
min(big)	count(big)	max(big)-1
0.0000	5	18446744072.0000
drop table if exists t1;
drop table if exists t2;
create table t1 (
decimald  decimal(6,5) not null,
value32  integer          not null,
primary key(value32)
);
create table t2 (
decimald  decimal(5,4)  not null,
value32  integer          not null,
primary key(value32)
);
insert into t1 values(0.1715600000, 1);
insert into t1 values(9.2234, 2);
insert into t2 values(1.7156e-1, 3);
insert into t2 values(9.2233720368547758070000000000, 4);
select * from t1;
decimald	value32
0.17156	1
9.22340	2
select * from t2;
decimald	value32
0.1716	3
9.2234	4
select * from t1 join t2 on t1.decimald=t2.decimald order by 1 asc, 2 desc;
decimald	value32	decimald	value32
9.22340	2	9.2234	4
select * from t1 join t2 on t1.decimald=t2.decimald where t1.decimald!=0;
decimald	value32	decimald	value32
9.22340	2	9.2234	4
select * from t1 join t2 on t1.decimald=t2.decimald order by 1,2 desc;
decimald	value32	decimald	value32
9.22340	2	9.2234	4
drop table if exists t1;
drop table if exists t2;
create table t1 (decimal20 decimal(20,18) not null);
insert into t1 values (1.4e-19),(1.4e-18);
select * from t1;
decimal20
0.000000000000000000
0.000000000000000001
DROP TABLE t1;
create table t1 (decimal_col decimal(29,0));
insert into t1 values (-17666000000000000000);
select * from t1 where decimal_col=-17666000000000000000 order by 1 asc;
decimal_col
-17666000000000000000
select * from t1 where decimal_col='-17666000000000000000' order by decimal_col desc;
decimal_col
-17666000000000000000
drop table t1;
select cast(10000002383263201056 as decimal) mod 50 as result;
result
49
select cast(cast(19999999999999999999 as decimal) as unsigned);
cast(cast(19999999999999999999 as decimal) as unsigned)
9999999999
CREATE TABLE t1 (id INT AUTO_INCREMENT PRIMARY KEY,
a decimal(20,0) UNSIGNED,
b VARCHAR(20));
INSERT INTO t1 (a) VALUES
(0.5000000000),(0.0000000001),
(CAST(0x7FFFFFFF AS decimal)),
(CAST(0x80000000 AS UNSIGNED)),
(CAST(0x7FFFFFFF AS UNSIGNED));
UPDATE t1 SET b = a;
select distinct * from t1 where ((a = '2147483647') and (b = '2147483647'));
id	a	b
3	2147483647	2147483647
5	2147483647	2147483647
select a,count(a) from t1 group by a having count(a)>=2;
a	count(a)
2147483647	2
CREATE TABLE t_decimal(id decimal(10,5));
INSERT INTO t_decimal VALUES (1), (2),(1.099999999),(2.20000000001);
select * from t_decimal;
id
1.00000
2.00000
1.10000
2.20000
SELECT id, id >= 1.1 FROM t_decimal;
id	id >= 1.1
1.00000	0
2.00000	1
1.10000	1
2.20000	1
SELECT id, 1.1 <= id FROM t_decimal;
id	1.1 <= id
1.00000	0
2.00000	1
1.10000	1
2.20000	1
SELECT id, id = 1.1 FROM t_decimal;
id	id = 1.1
1.00000	0
2.00000	0
1.10000	1
2.20000	0
SELECT id, 1.1 = id FROM t_decimal;
id	1.1 = id
1.00000	0
2.00000	0
1.10000	1
2.20000	0
SELECT * from t_decimal WHERE id = 1.1;
id
1.10000
SELECT * from t_decimal WHERE id = 1.1e0;
id
1.10000
SELECT * from t_decimal WHERE id = '1.1';
id
1.10000
SELECT * from t_decimal WHERE id = '1.1e0';
id
1.10000
SELECT * from t_decimal WHERE id IN (1.1, 2.2);
id
1.10000
2.20000
SELECT * from t_decimal WHERE id IN (1.1e0, 2.2e0);
id
1.10000
2.20000
SELECT * from t_decimal WHERE id IN ('1.1', '2.2');
id
1.10000
2.20000
SELECT * from t_decimal WHERE id IN ('1.1e0', '2.2e0');
id
1.10000
2.20000
SELECT * from t_decimal WHERE id BETWEEN 1.1 AND 1.9;
id
1.10000
SELECT * from t_decimal WHERE id BETWEEN 1.1e0 AND 1.9e0;
id
1.10000
SELECT * from t_decimal WHERE id BETWEEN '1.1' AND '1.9';
id
1.10000
SELECT * from t_decimal WHERE id BETWEEN '1.1e0' AND '1.9e0';
id
1.10000
DROP TABLE t1;
CREATE TABLE t1 (a decimal(2,1));
INSERT INTO t1 VALUES (1),(0.8999),(0.9);
SELECT * FROM t1 WHERE coalesce(a) BETWEEN 0 and 0.9;
a
0.9
0.9
SELECT * FROM t1 WHERE coalesce(a)=0.9;
a
0.9
0.9
SELECT * FROM t1 WHERE coalesce(a) in (0.8,0.9);
a
0.9
0.9
SELECT * FROM t1 WHERE a BETWEEN 0 AND 0.9;
a
0.9
0.9
SELECT * FROM t1 WHERE a=0.9;
a
0.9
0.9
SELECT * FROM t1 WHERE a IN (0.8,0.9);
a
0.9
0.9
DROP TABLE t1;
create table t (id decimal(23,3) unsigned, b int);
insert into t values(889475494977969.3574,1);
insert into t values(889475494977969.3579,2);
insert into t values(889475494977969.357,3);
select count(*) from t
where id>=88947549497796.3574 and id <=889475494977969.358;
count(*)
3
select count(*) from t
where id between 88947549497796.3574 and 889475494977969.358;
count(*)
3
drop table t;
SELECT CAST(1.00 AS decimal) BETWEEN 1 AND -1;
CAST(1.00 AS decimal) BETWEEN 1 AND -1
false
SELECT CAST(1.00 AS decimal) NOT BETWEEN 1 AND -1;
CAST(1.00 AS decimal) NOT BETWEEN 1 AND -1
true
SELECT CAST(-0 AS decimal) BETWEEN 0 AND -1;
CAST(-0 AS decimal) BETWEEN 0 AND -1
false
SELECT CAST(0 AS decimal) NOT BETWEEN 0 AND -1;
CAST(0 AS decimal) NOT BETWEEN 0 AND -1
true
drop table if exists t1;
drop table if exists t2;
drop table if exists t3;
drop table if exists t11;
drop table if exists t12;
CREATE TABLE t1 (a decimal(3,2), b decimal(5,2) primary key);
INSERT INTO t1 VALUES (1.00,1.0000),(1.00,2.0000);
update t1 set a=2.00 where a=1 limit 1;
select * from t1;
a	b
2.00	1.00
1.00	2.00
INSERT INTO t1 VALUES (1,3);
update t1 set a=2 where a=1.00;
select * from t1;
a	b
2.00	1.00
2.00	2.00
2.00	3.00
drop table t1;
create table t1 (
a decimal(10,5) not null,
b int not null default 12345.67890,
c decimal(10,5) not null default 12345.67890,
d decimal(10,5) not null default 12345.67890,
e decimal(10,5) not null default 12345.67890,
f decimal(10,5) not null default 12345.67890,
g decimal(10,5) not null default 12345.67890,
h decimal(10,5) not null default 12345.67890,
i decimal(10,5) not null default 12345.67890,
j decimal(10,5) not null default 12345.67890,
primary key (a));
insert into t1 (a) values (2),(4),(6),(8),(10),(12),(14),(16),(18),(20),(22),(24),(26),(23);
update t1 set a=a+101;
select a,b from t1;
a	b
103.00000	12346
105.00000	12346
107.00000	12346
109.00000	12346
111.00000	12346
113.00000	12346
115.00000	12346
117.00000	12346
119.00000	12346
121.00000	12346
123.00000	12346
124.00000	12346
125.00000	12346
127.00000	12346
update t1 set a=27 where a=125;
select a,b from t1;
a	b
27.00000	12346
103.00000	12346
105.00000	12346
107.00000	12346
109.00000	12346
111.00000	12346
113.00000	12346
115.00000	12346
117.00000	12346
119.00000	12346
121.00000	12346
123.00000	12346
124.00000	12346
127.00000	12346
update t1 set a=a-1 where 1 > 2;
select a,b from t1;
a	b
27.00000	12346
103.00000	12346
105.00000	12346
107.00000	12346
109.00000	12346
111.00000	12346
113.00000	12346
115.00000	12346
117.00000	12346
119.00000	12346
121.00000	12346
123.00000	12346
124.00000	12346
127.00000	12346
update t1 set a=a-1 where 3 > 2;
select a,b from t1;
a	b
26.00000	12346
102.00000	12346
104.00000	12346
106.00000	12346
108.00000	12346
110.00000	12346
112.00000	12346
114.00000	12346
116.00000	12346
118.00000	12346
120.00000	12346
122.00000	12346
123.00000	12346
126.00000	12346
drop table t1;
create table t1 (a decimal(10,5) primary key, b char(32));
insert into t1 values (1.000000,'apple'), (2.00,'apple');
select * from t1;
a	b
1.00000	apple
2.00000	apple
update t1, t1 as t2 set t1.a=t1.a*2 where t1.b = t2.b and t1.a > t2.a;
select * from t1;
a	b
1.00000	apple
4.00000	apple
drop table t1;
create table t11 (a decimal NOT NULL, b int, primary key (a));
create table t12 (a decimal NOT NULL, b int, primary key (a));
create table t2 (a decimal NOT NULL, b int, primary key (a));
insert into t11 values (0, 10),(1, 11),(2, 12);
insert into t12 values (33, 10),(0, 11),(2, 12);
insert into t2 values (0, 21),(1, 12),(3, 23);
update t12 join t11 on t11.a = t12.a set t11.a=t12.a where t11.b <> (select b from t2 where t11.a = t2.a);
select * from t11;
a	b
0	10
1	11
2	12
select * from t12;
a	b
0	11
2	12
33	10
update t11,t12 set t11.a=t11.a+t11.b where t11.b <> (select b from t2 where t11.a = t2.a);
select * from t11;
a	b
2	12
10	10
12	11
drop table if exists t1;
drop table if exists t2;
CREATE TABLE t1(a decimal PRIMARY KEY);
INSERT INTO t1 VALUES(10),(20);
CREATE TABLE t2(b decimal);
INSERT INTO t2 VALUES(10),(20);
update t1 JOIN t2 on t1.a=t2.b set t1.a=5.00000000 WHERE t1.a = 10;
select * from t1;
a
5
20
select * from t2;
b
10
20
drop table t1;
CREATE TABLE t1 ( a decimal PRIMARY KEY );
INSERT INTO t1 VALUES (0),(1),(2);
update t1 set a=a*10%3 WHERE t1.a > 0 ORDER BY t1.a LIMIT 1;
SELECT * FROM t1;
a
0
1
2
drop table if exists t1;
drop table if exists t2;
drop table if exists t3;
CREATE TABLE t1 (a decimal(10,5) not null,b int not null, primary key (a));
CREATE TABLE t2 (a decimal(10,5) not null,b int not null, primary key (a));
CREATE TABLE t3 (a decimal(10,5) not null,b int not null, primary key (a));
insert into t1 values (1,1),(2,1),(4,3);
insert into t2 values (1,1),(2,2),(3,3);
insert into t3 values (1,1),(2,1),(4,3);
update t1 join t2 on t1.a=t2.a join t3 on t1.b=t3.b set t1.a=((t3.a*5) DIV 5) where t1.a=t2.a AND t2.b=t3.a and t1.b=t3.b;
select * from t1;
a	b
1.00000	1
2.00000	1
4.00000	3
drop table t1;
create table t1(a decimal(10,5) not null);
insert into t1 values (0);
update t1 set a=a+(a MOD 2) where a is null;
select * from t1;
a
0.00000
DROP TABLE if exists t1,t2;
CREATE TABLE t1 (
a decimal
);
CREATE TABLE t2 (
a decimal
);
insert into t1 values(1),(2),(3),(4),(5);
insert into t2 values(1),(3),(5),(7),(9);
update t1 join t2 alias on t1.a=alias.a set alias.a=t1.a*3 WHERE t1.a = alias.a;
select * from t1;
a
1
2
3
4
5
drop table if exists t1;
drop table if exists t2;
create table t1 (id decimal,ti decimal unsigned,si decimal,bi decimal unsigned,fl decimal,dl decimal,de decimal,ch char(20),vch varchar(20),dd date,dt datetime);
insert into t1 values(1,1,4,3,1113.32,111332,1113.32,'hello','subquery','2022-04-28','2022-04-28 22:40:11');
insert into t1 values(2,2,5,2,2252.05,225205,2252.05,'bye','sub query','2022-04-28','2022-04-28 22:40:11');
insert into t1 values(3,6,6,3,3663.21,366321,3663.21,'hi','subquery','2022-04-28','2022-04-28 22:40:11');
insert into t1 values(4,7,1,5,4715.22,471522,4715.22,'good morning','my subquery','2022-04-28','2022-04-28 22:40:11');
insert into t1 values(5,1,2,6,51.26,5126,51.26,'byebye',' is subquery?','2022-04-28','2022-04-28 22:40:11');
insert into t1 values(6,3,2,1,632.1,6321,632.11,'good night','maybe subquery','2022-04-28','2022-04-28 22:40:11');
insert into t1 values(7,4,4,3,7443.11,744311,7443.11,'yes','subquery','2022-04-28','2022-04-28 22:40:11');
insert into t1 values(8,7,5,8,8758.00,875800,8758.11,'nice to meet','just subquery','2022-04-28','2022-04-28 22:40:11');
insert into t1 values(9,8,4,9,9849.312,9849312,9849.312,'see you','subquery','2022-04-28','2022-04-28 22:40:11');
update t1 sub set sub.id=id-99 where id > 4;
select count(*) from t1 where id>4;
count(*)
0
drop table if exists t1;
create table t1 (id decimal,ti decimal unsigned,si decimal,bi decimal unsigned,fl decimal,dl decimal,de decimal,ch char(20),vch varchar(20),dd date,dt datetime);
insert into t1 values(1,1,4,3,1113.32,111332,1113.32,'hello','subquery','2022-04-28','2022-04-28 22:40:11');
insert into t1 values(2,2,5,2,2252.05,225205,2252.05,'bye','sub query','2022-04-28','2022-04-28 22:40:11');
insert into t1 values(3,6,6,3,3663.21,366321,3663.21,'hi','subquery','2022-04-28','2022-04-28 22:40:11');
insert into t1 values(4,7,1,5,4715.22,471522,4715.22,'good morning','my subquery','2022-04-28','2022-04-28 22:40:11');
insert into t1 values(5,1,2,6,51.26,5126,51.26,'byebye',' is subquery?','2022-04-28','2022-04-28 22:40:11');
insert into t1 values(6,3,2,1,632.1,6321,632.11,'good night','maybe subquery','2022-04-28','2022-04-28 22:40:11');
insert into t1 values(7,4,4,3,7443.11,744311,7443.11,'yes','subquery','2022-04-28','2022-04-28 22:40:11');
insert into t1 values(8,7,5,8,8758.00,875800,8758.11,'nice to meet','just subquery','2022-04-28','2022-04-28 22:40:11');
insert into t1 values(9,8,4,9,9849.312,9849312,9849.312,'see you','subquery','2022-04-28','2022-04-28 22:40:11');
update t1 sub set sub.id=sub.id%4+sub.id where id < 4 || id > 5;
select * from t1 order by id+ti desc;
id	ti	si	bi	fl	dl	de	ch	vch	dd	dt
10	8	4	9	9849	9849312	9849	see you	subquery	2022-04-28	2022-04-28 22:40:11
8	7	5	8	8758	875800	8758	nice to meet	just subquery	2022-04-28	2022-04-28 22:40:11
10	4	4	3	7443	744311	7443	yes	subquery	2022-04-28	2022-04-28 22:40:11
6	6	6	3	3663	366321	3663	hi	subquery	2022-04-28	2022-04-28 22:40:11
4	7	1	5	4715	471522	4715	good morning	my subquery	2022-04-28	2022-04-28 22:40:11
8	3	2	1	632	6321	632	good night	maybe subquery	2022-04-28	2022-04-28 22:40:11
4	2	5	2	2252	225205	2252	bye	sub query	2022-04-28	2022-04-28 22:40:11
5	1	2	6	51	5126	51	byebye	 is subquery?	2022-04-28	2022-04-28 22:40:11
2	1	4	3	1113	111332	1113	hello	subquery	2022-04-28	2022-04-28 22:40:11
drop table if exists t1;
create table t1 (id decimal,ti decimal unsigned,si decimal,bi decimal unsigned,fl decimal,dl decimal,de decimal,ch char(20),vch varchar(20),dd date,dt datetime);
insert into t1 values(1,1,4,3,1113.32,111332,1113.32,'hello','subquery','2022-04-28','2022-04-28 22:40:11');
insert into t1 values(2,2,5,2,2252.05,225205,2252.05,'bye','sub query','2022-04-28','2022-04-28 22:40:11');
insert into t1 values(3,6,6,3,3663.21,366321,3663.21,'hi','subquery','2022-04-28','2022-04-28 22:40:11');
insert into t1 values(4,7,1,5,4715.22,471522,4715.22,'good morning','my subquery','2022-04-28','2022-04-28 22:40:11');
update t1,(select * from (select * from (select id,ti,si,de from (select * from t1 ) sub3 where fl <> 4.5 ) sub2 where ti > 1) sub1 where id >2 ) sub set t1.id=sub.id*10+t1.id where t1.id = 4;
select max(id) from t1;
max(id)
34
DROP TABLE IF EXISTS t1,t2,t3,t4;
create table t1 (a decimal);
create table t2 (a decimal, b int);
create table t3 (a decimal);
create table t4 (a decimal(10,5) not null, b int not null);
insert into t1 values (2);
insert into t2 values (1,7),(2,7);
insert into t4 values (4,8),(3,8),(5,9);
insert into t3 values (100),(8);
update t3,t2,t1 set t1.a=0 and t2.a=t2.a+t3.a where t3.a in (select b from t4 where b > 7);
select * from t1;
a
0
select * from t2;
a	b
1	7
2	7
drop table if exists t1;
drop table if exists t2;
drop table if exists t3;
drop table if exists t11;
drop table if exists t12;
CREATE TABLE t1 (a decimal(3,2), b decimal(5,4) primary key);
INSERT INTO t1 VALUES (1,1),(1,2);
delete from t1 where a=1 limit 1;
select * from t1;
a	b
1.00	2.0000
INSERT INTO t1 VALUES (1,3);
delete from t1 where a=1;
select * from t1;
a	b
drop table t1;
create table t1 (
a decimal(10,5) not null,
b int not null default 12345.67890,
c decimal(10,5) not null default 12345.67890,
d decimal(10,5) not null default 12345.67890,
e decimal(10,5) not null default 12345.67890,
f decimal(10,5) not null default 12345.67890,
g decimal(10,5) not null default 12345.67890,
h decimal(10,5) not null default 12345.67890,
i decimal(10,5) not null default 12345.67890,
j decimal(10,5) not null default 12345.67890,
primary key (a));
insert into t1 (a) values (2.1111),(4),(00006.12311),(8.41231),(24.0000);
delete from t1 where a=2+2.0000;
select a,b from t1;
a	b
2.11110	12346
6.12311	12346
8.41231	12346
24.00000	12346
delete from t1 where  a=24.0000;
select a,b from t1;
a	b
2.11110	12346
6.12311	12346
8.41231	12346
delete from t1 where  3 < 2;
select a,b from t1;
a	b
2.11110	12346
6.12311	12346
8.41231	12346
delete from t1 where  1 < 2;
select a,b from t1;
a	b
drop table t1;
create table t1 (a decimal(10,5) primary key, b char(32));
insert into t1 values (1.000000,'apple'), (2.00,'apple');
select * from t1;
a	b
1.00000	apple
2.00000	apple
delete t1 from t1,t1 as t2 where t1.b = t2.b and t1.a > t2.a;
select * from t1;
a	b
1.00000	apple
drop table t1;
create table t11 (a decimal NOT NULL, b int, primary key (a));
create table t12 (a decimal NOT NULL, b int, primary key (a));
create table t2 (a decimal NOT NULL, b int, primary key (a));
insert into t11 values (0.111,10),(1.0000, 11),(12.111111, 12);
insert into t12 values (33, 10),(0, 11),(2, 12);
insert into t2 values (0.111, 21),(1.000, 12),(3, 23);
delete from t11 where t11.b <> (select b from t2 where t11.a = t2.a);
select * from t11;
a	b
12	12
delete t11,t12 from t11,t12 where t11.b <> (select b from t2 where t11.a = t2.a) or t12.a>1;
select * from t11;
a	b
select * from t12;
a	b
0	11
drop table if exists t1;
drop table if exists t2;
CREATE TABLE t1(a decimal(10,8) PRIMARY KEY);
INSERT INTO t1 VALUES(10.0000),(20.444411111);
CREATE TABLE t2(b decimal);
INSERT INTO t2 VALUES(10),(20.444411110);
delete t1,t2 from t1 JOIN t2 on t1.a=t2.b WHERE t1.a = 10;
select * from t1;
a
20.44441111
select * from t2;
b
20
drop table if exists t1;
drop table if exists t2;
drop table if exists t3;
CREATE TABLE t1 (a decimal(10,5) not null,b int not null, primary key (a));
CREATE TABLE t2 (a decimal(6,5) not null,b int not null, primary key (a));
CREATE TABLE t3 (a decimal(7,3) not null,b int not null, primary key (a));
insert into t1 values (1.00000,1),(2.00000,1),(4,3);
insert into t2 values (1.0,1),(2.0,2),(3.00000,3);
insert into t3 values (1.000,1),(2.000,1),(4,3);
delete t1,t2,t3 from t1 join t2 on t1.a=t2.a join t3 on t1.b=t3.b where t1.a=t2.a AND t2.b=t3.a and t1.b=t3.b;
select * from t1;
a	b
4.00000	3
drop table t1;
create table t1(a decimal(10,5) not null);
insert into t1 values (0.00000);
delete t1 from t1 where a is null;
select * from t1;
a
0.00000
DROP TABLE if exists t1,t2;
CREATE TABLE t1 (
a decimal
);
CREATE TABLE t2 (
a decimal
);
insert into t1 values(1.00000),(2.00000),(3),(4.0),(5.000000000000);
insert into t2 values(1),(3.0000000),(5),(7.000),(9.000000);
delete alias from t1 join t2 alias on t1.a=alias.a+1 WHERE t1.a = alias.a;
select * from t2;
a
1
3
5
7
9
drop table if exists t1;
create table t1 (id decimal,ti decimal unsigned,si decimal,bi decimal unsigned,fl decimal,dl decimal,de decimal,ch char(20),vch varchar(20),dd date,dt datetime);
insert into t1 values(1,1,4,3,1113.32,111332,1113.32,'hello','subquery','2022-04-28','2022-04-28 22:40:11');
insert into t1 values(2,2,5,2,2252.05,225205,2252.05,'bye','sub query','2022-04-28','2022-04-28 22:40:11');
insert into t1 values(3,6,6,3,3663.21,366321,3663.21,'hi','subquery','2022-04-28','2022-04-28 22:40:11');
insert into t1 values(4,7,1,5,4715.22,471522,4715.22,'good morning','my subquery','2022-04-28','2022-04-28 22:40:11');
insert into t1 values(5,1,2,6,51.26,5126,51.26,'byebye',' is subquery?','2022-04-28','2022-04-28 22:40:11');
insert into t1 values(6,3,2,1,632.1,6321,632.11,'good night','maybe subquery','2022-04-28','2022-04-28 22:40:11');
insert into t1 values(7,4,4,3,7443.11,744311,7443.11,'yes','subquery','2022-04-28','2022-04-28 22:40:11');
insert into t1 values(8,7,5,8,8758.00,875800,8758.11,'nice to meet','just subquery','2022-04-28','2022-04-28 22:40:11');
insert into t1 values(9,8,4,9,9849.312,9849312,9849.312,'see you','subquery','2022-04-28','2022-04-28 22:40:11');
delete from t1 where si < 10000.1111 || id > 5;
select * from t1;
id	ti	si	bi	fl	dl	de	ch	vch	dd	dt
drop table if exists t1;
create table t1 (id decimal,ti decimal unsigned,si decimal,bi decimal unsigned,fl decimal,dl decimal,de decimal,ch char(20),vch varchar(20),dd date,dt datetime);
insert into t1 values(1,1,4,3,1113.32,111332,1113.32,'hello','subquery','2022-04-28','2022-04-28 22:40:11');
insert into t1 values(2,2,5,2,2252.05,225205,2252.05,'bye','sub query','2022-04-28','2022-04-28 22:40:11');
insert into t1 values(3,6,6,3,3663.21,366321,3663.21,'hi','subquery','2022-04-28','2022-04-28 22:40:11');
insert into t1 values(4,7,1,5,4715.22,471522,4715.22,'good morning','my subquery','2022-04-28','2022-04-28 22:40:11');
delete t1 from t1,((select * from (select * from (select id,ti,si,de from (select * from t1 ) sub3 where fl <> 4.5 ) sub2 where ti > 1) sub1 where id >2 )) sub2 where t1.id=sub2.id;
select id from t1;
id
1
2
DROP TABLE IF EXISTS t1,t2,t3,t4;
create table t3 (a decimal);
create table t4 (a decimal(10,5) not null, b decimal not null);
insert into t4 values (4,8.0000),(3,8.00001),(5,9);
insert into t3 values (100),(8.00001);
delete t3 from t3,t4 where t3.a in (select b from t4 where b > 7);
select * from t3;
a
100
