select -1.7976931348623157E+308,-2.2250738585072014E-308,0,2.2250738585072014E-308,1.7976931348623157E+308;
-1.7976931348623157E+308	-2.2250738585072014E-308	0	2.2250738585072014E-308	1.7976931348623157E+308
-1.7976931348623157e308	-2.2250738585072014e-308	0	2.2250738585072014e-308	1.7976931348623157e308
select 1.7976931348623158E+308,-2.2250738585072015E-308,2.2250738585072015E-308,1.7976931348623158E+308;
1.7976931348623158E+308	-2.2250738585072015E-308	2.2250738585072015E-308	1.7976931348623158E+308
1.7976931348623157e308	-2.2250738585072014e-308	2.2250738585072014e-308	1.7976931348623157e308
select 1.7976931348623158E+308*1,-2.2250738585072015E-308+1.2250738585072015E-308;
1.7976931348623158E+308*1	-2.2250738585072015E-308+1.2250738585072015E-308
1.7976931348623157e308	-1e-308
drop table if exists t1;
create table t1 (a double not null, primary key(a));
insert into t1 values(-1.7976931348623157E+308),(-2.2250738585072014E-308),(0),(2.2250738585072014E-308),(1.7976931348623157E+308);
select * from t1;
a
-1.7976931348623157e308
-2.2250738585072014e-308
0
2.2250738585072014e-308
1.7976931348623157e308
delete from t1 where a>0;
drop table if exists t1;
create table t1(a double(53,30));
insert into t1 values(-1.7976931348623157),(2.2250738585072014),(0),(2.2250738585072014),(1.7976931348623157);
select * from t1;
a
-1.797693134862315700000000000000
2.225073858507201400000000000000
0.000000000000000000000000000000
2.225073858507201400000000000000
1.797693134862315700000000000000
drop table if exists t1;
create table t1(a double(53,5));
insert into t1 values(-1.7976931348623157),(2.2250738585072014),(0),(2.2250738585072014),(1.7976931348623157);
select * from t1;
a
-1.79769
2.22507
0.00000
2.22507
1.79769
drop table t1;
create table t1(a float(34));
show create table t1;
Table	Create Table
t1	CREATE TABLE `t1` (
  `a` double DEFAULT NULL
) ENGINE=InnoDB DEFAULT CHARSET=utf8mb4 COLLATE=utf8mb4_0900_ai_ci
drop table t1;
create table t1 ( a double not null default 1, big double(30,5) );
insert into t1 (big) values (-1),(12345678.901234567),(92233720368547.75807);
select * from t1;
a	big
1	-1.00000
1	12345678.90123
1	92233720368547.77000
select min(big),max(big),max(big)-1 from t1;
min(big)	max(big)	max(big)-1
-1.00000	92233720368547.77000	92233720368546.77000
select min(big),max(big),max(big)-1 from t1 group by a;
min(big)	max(big)	max(big)-1
-1.00000	92233720368547.77000	92233720368546.77000
drop table t1;
create table t1 ( a double not null default 1, big double);
insert into t1 (big) values (-1),(12345678.901234567),(92233720368547.75807);
select * from t1;
a	big
1	-1
1	12345678.901234567
1	92233720368547.77
select min(big),max(big),max(big)-1 from t1;
min(big)	max(big)	max(big)-1
-1	92233720368547.77	92233720368546.77
select min(big),max(big),max(big)+1 from t1 group by a;
min(big)	max(big)	max(big)+1
-1	92233720368547.77	92233720368548.77
drop table t1;
create table t1 (id double auto_increment primary key, a int) auto_increment=1;
insert into t1 values (null,1);
insert into t1 values (null,2);
insert into t1 values (null,3);
insert into t1 values (null,4);
select * from t1 order by id desc;
id	a
4	4
3	3
2	2
1	1
drop table if exists t1,t2;
create table t1 (
a double not null,
b double not null,
primary key(a)
);
create table t2 (
a  double  not null,
b  integer  not null,
primary key(a)
);
insert into t1 values(0.123456, 1);
insert into t1 values(1.23456, 2);
insert into t2 values(1.23456e-1, 3);
insert into t2 values(1.23456e1, 4);
insert into t1 values(3,5);
select * from t1;
a	b
0.123456	1
1.23456	2
3	5
select * from t2;
a	b
0.123456	3
12.3456	4
select * from t1 join t2 on t1.a=t2.a;
a	b	a	b
0.123456	1	0.123456	3
select * from t1 join t2 on t1.a=t2.a where t1.a>=0.123456;
a	b	a	b
0.123456	1	0.123456	3
select * from t1 join t2 on t2.b=t1.a;
a	b	a	b
3	5	0.123456	3
drop table if exists t1, t2;
create table t1 (a double);
insert into t1 values (17.666);
select * from t1 where a>=17.6660;
a
17.666
select * from t1 where a>='17.6660';
a
17.666
drop table t1;
CREATE TABLE t1 (id INT AUTO_INCREMENT PRIMARY KEY,
a double(20,0),
b VARCHAR(20));
INSERT INTO t1 (a) VALUES
(0),
(CAST(0x7FFFFFFFFFFFFFFF AS UNSIGNED)),
(CAST(0x8000000000000000 AS UNSIGNED)),
(CAST(0xFFFFFFFFFFFFFFFF AS UNSIGNED));
select * from t1;
id	a	b
1	0	NULL
2	9223372036854776000	NULL
3	9223372036854776000	NULL
4	18446744073709552000	NULL
UPDATE t1 SET b = a;
select * from t1;
id	a	b
1	0	0
2	9223372036854776000	9.223372036854776e18
3	9223372036854776000	9.223372036854776e18
4	18446744073709552000	1.844674407370955e19
select a,count(a) from t1 where ((a = 9.223372036854776e18) and (b = '9.223372036854776e18')) group by a having count(a)>1;
a	count(a)
9223372036854776000	2
select distinct a,b from t1 where ((a = 1.844674407370955e19) and (b != '9.223372036854776e18'));
a	b
CREATE TABLE t_double(id double(30,1));
INSERT INTO t_double VALUES (1.19),(1.11), (2);
SELECT id, id >= 1.1 FROM t_double;
id	id >= 1.1
1.2	1
1.1	1
2.0	1
SELECT id, 1.1 <= id FROM t_double;
id	1.1 <= id
1.2	1
1.1	1
2.0	1
SELECT id, id = 1.1 FROM t_double;
id	id = 1.1
1.2	0
1.1	1
2.0	0
SELECT id, 1.1 = id FROM t_double;
id	1.1 = id
1.2	0
1.1	1
2.0	0
SELECT * from t_double WHERE id = 1.1;
id
1.1
SELECT * from t_double WHERE id = 1.1e0;
id
1.1
SELECT * from t_double WHERE id = '1.1';
id
1.1
SELECT * from t_double WHERE id = '1.1e0';
id
1.1
SELECT * from t_double WHERE id IN (1.1, 2.2);
id
1.1
SELECT * from t_double WHERE id IN (1.1e0, 2.2e0);
id
1.1
SELECT * from t_double WHERE id IN ('1.1', '2.2');
id
1.1
SELECT * from t_double WHERE id IN ('1.1e0', '2.2e0');
id
1.1
SELECT * from t_double WHERE id BETWEEN 1.1 AND 1.9;
id
1.2
1.1
SELECT * from t_double WHERE id BETWEEN 1.1e0 AND 1.9e0;
id
1.2
1.1
SELECT * from t_double WHERE id BETWEEN '1.1' AND '1.9';
id
1.2
1.1
SELECT * from t_double WHERE id BETWEEN '1.1e0' AND '1.9e0';
id
1.2
1.1
DROP TABLE t1;
CREATE TABLE t1 (a double(5,4));
INSERT INTO t1 VALUES (1),(0.8999),(0.800000);
SELECT * FROM t1 WHERE coalesce(a) BETWEEN 0 and 0.9;
a
0.8999
0.8000
SELECT * FROM t1 WHERE a=0.9;
a
SELECT * FROM t1 WHERE a in (0.8,0.9);
a
0.8000
SELECT * FROM t1 WHERE a BETWEEN 0 AND 0.9;
a
0.8999
0.8000
DROP TABLE t1;
create table t1 (id double, b int);
insert into t1 values(4.571231231231233534314,1);
insert into t1 values(5.31110909092103910293012,2);
insert into t1 values(177.1715012301203103111,3);
select count(*) from t1
where id>=5.3111 and id <=177.171;
count(*)
1
select count(*) from t1
where id between 5.3111 and 177.171;
count(*)
1
drop table t1;
