create table t1 (a int unsigned not null, primary key(a));
insert into t1 values (4294967295), (0xFFFFFFFE), (4294967293), (4294967291);
select * from t1;
a
4294967291
4294967293
4294967294
4294967295
select * from t1 where a=4294967295;
a
4294967295
delete from t1 where a=4294967295;
select * from t1;
a
4294967291
4294967293
4294967294
drop table t1;
create table t1 ( a int not null default 1, int32 int );
insert into t1 (int32) values (-1),(1234567890),(2147483647);
select * from t1;
a	int32
1	-1
1	1234567890
1	2147483647
select min(int32),max(int32),max(int32)-1 from t1;
min(int32)	max(int32)	max(int32)-1
-1	2147483647	2147483646
select min(int32),max(int32),max(int32)-1 from t1 group by a;
min(int32)	max(int32)	max(int32)-1
-1	2147483647	2147483646
drop table t1;
create table t1 ( a int not null default 1, int32 int unsigned);
insert into t1 (int32) values (0),(4294967295), (0xFFFFFFFE), (4294967293), (4294967291);
select * from t1;
a	int32
1	0
1	4294967295
1	4294967294
1	4294967293
1	4294967291
select min(int32),max(int32),max(int32)-1 from t1;
min(int32)	max(int32)	max(int32)-1
0	4294967295	4294967294
select min(int32),max(int32),max(int32)-1 from t1 group by a;
min(int32)	max(int32)	max(int32)-1
0	4294967295	4294967294
drop table t1;
create table t1 (id int auto_increment primary key, a int) auto_increment=999999999;
insert into t1 values (null,1);
select * from t1;
id	a
999999999	1
select * from t1 limit 9999999999;
id	a
999999999	1
drop table if exists t1,t2;
create table t1 (
valueu32  int unsigned  not null,
value32  integer          not null,
primary key(valueu32, value32)
);
create table t2 (
valueu32  int unsigned  not null,
value32  integer          not null,
primary key(valueu32, value32)
);
insert into t1 values(4294967295, 1);
insert into t1 values( 2147483647, 2);
insert into t2 values(4294967295, 3);
insert into t2 values( 2147483647, 4);
insert into t1 values(5,-2147483648);
insert into t2 values(5,-2147483648);
select * from t1;
valueu32	value32
5	-2147483648
2147483647	2
4294967295	1
select * from t2;
valueu32	value32
5	-2147483648
2147483647	4
4294967295	3
select * from t1 join t2 on t1.valueu32=t2.valueu32;
valueu32	value32	valueu32	value32
5	-2147483648	5	-2147483648
2147483647	2	2147483647	4
4294967295	1	4294967295	3
select * from t1 join t2 on t1.valueu32=t2.valueu32 where t1.valueu32=4294967295;
valueu32	value32	valueu32	value32
4294967295	1	4294967295	3
select * from t1 join t2 on t1.value32=t2.value32;
valueu32	value32	valueu32	value32
5	-2147483648	5	-2147483648
drop table t1, t2;
create table t1 (sint32 int not null);
insert into t1 values (-2147483648);
select * from t1;
sint32
-2147483648
DROP TABLE t1;
create table t1 (int_col int unsigned);
insert into t1 values (4294960000);
select * from t1 where int_col=4294960000;
int_col
4294960000
select * from t1 where int_col='4294960000';
int_col
4294960000
drop table t1;
select cast(4294960000 as unsigned) mod 50 as result;
result
0
select cast(2147399999 as signed);
cast(2147399999 as signed)
2147399999
select cast(-2147399999 as signed);
cast(-2147399999 as signed)
-2147399999
CREATE TABLE t1 (id INT AUTO_INCREMENT PRIMARY KEY,
a INT(10) UNSIGNED,
b VARCHAR(10));
INSERT INTO t1 (a) VALUES
(0),
(CAST(0x7FFFFFFF AS UNSIGNED)),
(CAST(0x80000000 AS UNSIGNED)),
(CAST(0xFFFFFFFF AS UNSIGNED));
UPDATE t1 SET b = a;
select * from t1 where ((a = 4294967295) and (b = '4294967295'));
id	a	b
4	4294967295	4294967295
CREATE TABLE t_int(id INT);
INSERT INTO t_int VALUES (1), (2);
SELECT id, id >= 1.1 FROM t_int;
id	id >= 1.1
1	0
2	1
SELECT id, 1.1 <= id FROM t_int;
id	1.1 <= id
1	0
2	1
SELECT id, id = 1.1 FROM t_int;
id	id = 1.1
1	0
2	0
SELECT id, 1.1 = id FROM t_int;
id	1.1 = id
1	0
2	0
SELECT * from t_int WHERE id = 1.1;
id
SELECT * from t_int WHERE id = 1.1e0;
id
SELECT * from t_int WHERE id = '1.1';
id
SELECT * from t_int WHERE id = '1.1e0';
id
SELECT * from t_int WHERE id IN (1.1, 2.2);
id
SELECT * from t_int WHERE id IN (1.1e0, 2.2e0);
id
SELECT * from t_int WHERE id IN ('1.1', '2.2');
id
SELECT * from t_int WHERE id IN ('1.1e0', '2.2e0');
id
SELECT * from t_int WHERE id BETWEEN 1.1 AND 1.9;
id
SELECT * from t_int WHERE id BETWEEN 1.1e0 AND 1.9e0;
id
SELECT * from t_int WHERE id BETWEEN '1.1' AND '1.9';
id
SELECT * from t_int WHERE id BETWEEN '1.1e0' AND '1.9e0';
id
DROP TABLE t1;
CREATE TABLE t1 (a INT);
INSERT INTO t1 VALUES (1);
SELECT * FROM t1 WHERE coalesce(a) BETWEEN 0 and 0.9;
a
SELECT * FROM t1 WHERE coalesce(a)=0.9;
a
SELECT * FROM t1 WHERE coalesce(a) in (0.8,0.9);
a
SELECT * FROM t1 WHERE a BETWEEN 0 AND 0.9;
a
SELECT * FROM t1 WHERE a=0.9;
a
SELECT * FROM t1 WHERE a IN (0.8,0.9);
a
DROP TABLE t1;
create table t (id int unsigned, b int);
insert into t values(2147483647,1);
insert into t values(4294967295,2);
insert into t values(2147483643,3);
select count(*) from t
where id>=2147483647 and id <=4294967295;
count(*)
2
select count(*) from t
where id between 2147483647 and 4294967295;
count(*)
2
drop table t;
SELECT (4294967294 BETWEEN 0 AND 4294967295);
(4294967294 BETWEEN 0 AND 4294967295)
1
SELECT  -2147483600 <= 0;
-2147483600 <= 0
1
SELECT 0 <= 2147483647;
0 <= 2147483647
1
SELECT CAST(100 AS UNSIGNED) BETWEEN 1 AND -1;
CAST(100 AS UNSIGNED) BETWEEN 1 AND -1
0
SELECT CAST(100 AS UNSIGNED) NOT BETWEEN 1 AND -1;
CAST(100 AS UNSIGNED) NOT BETWEEN 1 AND -1
1
SELECT CAST(0 AS UNSIGNED) BETWEEN 0 AND -1;
CAST(0 AS UNSIGNED) BETWEEN 0 AND -1
0
SELECT CAST(0 AS UNSIGNED) NOT BETWEEN 0 AND -1;
CAST(0 AS UNSIGNED) NOT BETWEEN 0 AND -1
1
SELECT ( 4294967296 BETWEEN 4294967296 AND 4294967296 );
( 4294967296 BETWEEN 4294967296 AND 4294967296 )
1
SELECT ( 2147483647 BETWEEN 4294967296 AND 1 );
( 2147483647 BETWEEN 4294967296 AND 1 )
0
SELECT ( -1 BETWEEN 4294967296 AND 1 );
( -1 BETWEEN 4294967296 AND 1 )
0
SELECT ( 0 BETWEEN 4294967296 AND 1 );
( 0 BETWEEN 4294967296 AND 1 )
0
SELECT ( 1 BETWEEN 4294967296 AND 1 );
( 1 BETWEEN 4294967296 AND 1 )
0
