drop table if exists t1;
create table t1 (a timestamp(0) not null, primary key(a));
insert into t1 values (20200101000000), ('2022-01-02'), ('2022-01-02 00:00:01'), ('2022-01-02 00:00:01.512345');
select * from t1;
a
2020-01-01 00:00:00
2022-01-02 00:00:00
2022-01-02 00:00:01
2022-01-02 00:00:02
select * from t1 where a='2022-01-02';
a
2022-01-02 00:00:00
select * from t1 where a>20220102;
a
2022-01-02 00:00:01
2022-01-02 00:00:02
select * from t1 where a!='2022-01-02';
a
2020-01-01 00:00:00
2022-01-02 00:00:01
2022-01-02 00:00:02
update t1 set a=DATE_ADD(a ,INTERVAL 1 WEEK) where a>'20220102';
select * from t1;
a
2020-01-01 00:00:00
2022-01-02 00:00:00
2022-01-09 00:00:01
2022-01-09 00:00:02
drop table t1;
create table t1 ( a int not null default 1, big timestamp(4) primary key);
insert into t1 (big) values (20220103),('2022-01-01'),('2022-01-01 00:00:01'),('2022-01-02 00:00.00.000050');
select * from t1;
a	big
1	2022-01-01 00:00:00.0000
1	2022-01-01 00:00:01.0000
1	2022-01-02 00:00:00.0001
1	2022-01-03 00:00:00.0000
select * from t1 order by big limit 1,3;
a	big
1	2022-01-01 00:00:01.0000
1	2022-01-02 00:00:00.0001
1	2022-01-03 00:00:00.0000
select * from t1 order by big limit 3 offset 1;
a	big
1	2022-01-01 00:00:01.0000
1	2022-01-02 00:00:00.0001
1	2022-01-03 00:00:00.0000
select min(big),max(big),max(big)-1 from t1 group by a;
min(big)	max(big)	max(big)-1
2022-01-01 00:00:00.0000	2022-01-03 00:00:00.0000	20220102999999.0000
select big,count(big) from t1 group by big having count(big)>1 order by 2;
big	count(big)
drop table t1;
create table t1 (id timestamp(6) not null default "2022-01-31 00:00:00.0000006", a int, primary key (a));
insert into t1(a) values(1);
select * from t1;
id	a
2022-01-31 00:00:00.000001	1
drop table if exists t1;
drop table if exists t2;
create table t1 (
dt  timestamp(6) not null,
value32  integer not null,
primary key(value32)
);
create table t2 (
dt  timestamp(3) not null,
value32  integer not null,
primary key(value32)
);
insert into t1 values('2022-01-01 00:00:00.000050', 1);
insert into t1 values('2022-01-01 00:00:00.000500', 2);
insert into t1 values('2022-01-01 00:00:00.005000', 3);
insert into t2 values('2022-01-01 00:00:00.005', 4);
insert into t2 values('2022-01-01 00:00:00.001', 5);
select * from t1;
dt	value32
2022-01-01 00:00:00.000050	1
2022-01-01 00:00:00.000500	2
2022-01-01 00:00:00.005000	3
select * from t2;
dt	value32
2022-01-01 00:00:00.001	5
2022-01-01 00:00:00.005	4
select * from t1 join t2 on t1.dt=t2.dt order by 1 desc, t2.dt asc;
dt	value32	dt	value32
2022-01-01 00:00:00.005000	3	2022-01-01 00:00:00.005	4
select * from t1 join t2 on t1.dt=t2.dt where t1.value32<>t2.value32;
dt	value32	dt	value32
2022-01-01 00:00:00.005000	3	2022-01-01 00:00:00.005	4
drop table if exists t1;
drop table if exists t2;
CREATE TABLE t_timestamp(id timestamp(6));
INSERT INTO t_timestamp VALUES ('2020-01-01 23:59:59.999999'), ('2022-01-02 00:00:00');
SELECT id, id >= 20200102 FROM t_timestamp;
id	id >= 20200102
2020-01-01 23:59:59.999999	false	
2022-01-02 00:00:00.000000	true	
SELECT id, id = 202020101 FROM t_timestamp;
id	id = 202020101
2020-01-01 23:59:59.999999	false	
2022-01-02 00:00:00.000000	false	
SELECT id, 20200101 = id FROM t_timestamp;
id	20200101 = id
2020-01-01 23:59:59.999999	false	
2022-01-02 00:00:00.000000	false	
SELECT * from t_timestamp WHERE id = 20200102;
id
SELECT * from t_timestamp WHERE id = 2.0200102e7;
id
SELECT * from t_timestamp WHERE id = '20200102';
id
SELECT * from t_timestamp WHERE id IN ('2020-01-01','2022-01-02');
id
2022-01-02 00:00:00.000000
SELECT * from t_timestamp WHERE id IN (2.0200101e7,2.0200102e7 );
id
SELECT * from t_timestamp WHERE id IN (20220101, 20220102);
id
2022-01-02 00:00:00.000000
SELECT * from t_timestamp WHERE id IN ('2.0200101e7','2.0200102e7');
id
SELECT * from t_timestamp WHERE id BETWEEN 20191231 AND 20200101;
id
SELECT * from t_timestamp WHERE id BETWEEN 2.0200101e7 and 2.0200102e7;
id
2020-01-01 23:59:59.999999
SELECT * from t_timestamp WHERE id BETWEEN '2020-01-01' AND '2020-01-02';
id
2020-01-01 23:59:59.999999
SELECT * from t_timestamp WHERE id BETWEEN '2022-01-01 00:00:00' AND '2022-01-02 00:00:00.000000';
id
2022-01-02 00:00:00.000000
drop table if exists t1;
CREATE TABLE t1 (a timestamp(6));
INSERT INTO t1 VALUES ('2022-03-01 00:00:01.0001');
SELECT * FROM t1 WHERE coalesce(a) not BETWEEN '2022-02-28' and '2022-03-01';
a
2022-03-01 00:00:01.000100
SELECT * FROM t1 WHERE coalesce(a)!=20220301;
a
2022-03-01 00:00:01.000100
SELECT * FROM t1 WHERE coalesce(a) in ('2022-03-01','2022-03-01 00:00:00.0001');
a
drop table t1;
drop table if exists t1;
drop table if exists t2;
drop table if exists t3;
drop table if exists t21;
drop table if exists t12;
CREATE TABLE t1 (a timestamp, b int primary key);
INSERT INTO t1 VALUES ('2022-01-01 00:00:00',1),('2022-01-01 00:00:00',2);
update t1 set a='2022-01-02' where a='2022-01-01 00:00:00' limit 1;
select * from t1;
a	b
2022-01-02 00:00:00	1
2022-01-01 00:00:00	2
INSERT INTO t1 VALUES ('2022-01-01 00:00:00',3);
update t1 set a='2022-01-02' where a='2022-01-01 00:00:00';
select * from t1;
a	b
2022-01-02 00:00:00	1
2022-01-02 00:00:00	2
2022-01-02 00:00:00	3
drop table t1;
create table t1 (
a timestamp primary key,
b timestamp(4) not null default '2000-01-01 00:00:00'
);
insert into t1 (a) values ('2022-01-02'),('2022-01-04'),('2022-01-06'),('2022-01-08'),('2022-01-10 01:01:01.000'),('2022-01-12');
update t1 set a=a+101;
select a,b from t1;
a	b
2022-01-02 00:01:01	2000-01-01 00:00:00.0000
2022-01-04 00:01:01	2000-01-01 00:00:00.0000
2022-01-06 00:01:01	2000-01-01 00:00:00.0000
2022-01-08 00:01:01	2000-01-01 00:00:00.0000
2022-01-10 01:02:02	2000-01-01 00:00:00.0000
2022-01-12 00:01:01	2000-01-01 00:00:00.0000
update t1 set a='2022-01-27 12:12:12.0001' where a='2022-01-08 00:01:01';
select a,b from t1;
a	b
2022-01-02 00:01:01	2000-01-01 00:00:00.0000
2022-01-04 00:01:01	2000-01-01 00:00:00.0000
2022-01-06 00:01:01	2000-01-01 00:00:00.0000
2022-01-10 01:02:02	2000-01-01 00:00:00.0000
2022-01-12 00:01:01	2000-01-01 00:00:00.0000
2022-01-27 12:12:12	2000-01-01 00:00:00.0000
update t1 set a=a-1 where 1 > 2;
select a,b from t1;
a	b
2022-01-02 00:01:01	2000-01-01 00:00:00.0000
2022-01-04 00:01:01	2000-01-01 00:00:00.0000
2022-01-06 00:01:01	2000-01-01 00:00:00.0000
2022-01-10 01:02:02	2000-01-01 00:00:00.0000
2022-01-12 00:01:01	2000-01-01 00:00:00.0000
2022-01-27 12:12:12	2000-01-01 00:00:00.0000
update t1 set a=a-1 where 3 > 2;
select a,b from t1;
a	b
2022-01-02 00:01:00	2000-01-01 00:00:00.0000
2022-01-04 00:01:00	2000-01-01 00:00:00.0000
2022-01-06 00:01:00	2000-01-01 00:00:00.0000
2022-01-10 01:02:01	2000-01-01 00:00:00.0000
2022-01-12 00:01:00	2000-01-01 00:00:00.0000
2022-01-27 12:12:11	2000-01-01 00:00:00.0000
drop table t1;
create table t1 (a timestamp primary key, b char(32));
insert into t1 values (20220101,'apple'),('2022-01-02','apple');
select * from t1;
a	b
2022-01-01 00:00:00	apple
2022-01-02 00:00:00	apple
update t1, t1 as t2 set t1.a=t1.a+1*5 where t1.b = t2.b and t1.a > t2.a;
select * from t1;
a	b
2022-01-01 00:00:00	apple
2022-01-02 00:00:05	apple
drop table if exists t11;
drop table if exists t12;
drop table if exists t2;
create table t11 (a timestamp(6) NOT NULL, b int, primary key (a));
create table t12 (a timestamp(6) NOT NULL, b int, primary key (a));
create table t2 (a timestamp(6) NOT NULL, b int, primary key (a));
insert into t11 values (20220103, 10),('2022-01-01 00:00:00', 11),('2022-01-02', 12);
insert into t12 values (20220303, 10),('2020-01-03 01:00:00.00000', 11),(20220102, 12);
insert into t2 values ('2021-12-31', 21),('2022-01-01 00:00:00', 12),('2022-03-03', 23);
select * from t11;
a	b
2022-01-01 00:00:00.000000	11
2022-01-02 00:00:00.000000	12
2022-01-03 00:00:00.000000	10
select * from t12;
a	b
2020-01-03 01:00:00.000000	11
2022-01-02 00:00:00.000000	12
2022-03-03 00:00:00.000000	10
update t11,t12 set t11.a=t11.a+t12.b where t12.a <> (select a from t2 where t11.a = t2.a);
select * from t11;
a	b
2022-01-01 00:00:11.000000	11
2022-01-02 00:00:00.000000	12
2022-01-03 00:00:00.000000	10
drop table if exists t1;
drop table if exists t2;
CREATE TABLE t1(a timestamp PRIMARY KEY);
INSERT INTO t1 VALUES('2022-10-01'),(20220220);
CREATE TABLE t2(b timestamp);
INSERT INTO t2 VALUES('2022-10-01'),(20220220);
update t1 JOIN t2 on t1.a=t2.b set t1.a='2022-05-05 01:01:01' WHERE t1.a=20221001;
select * from t1;
a
2022-02-20 00:00:00
2022-05-05 01:01:01
select * from t2;
b
2022-10-01 00:00:00
2022-02-20 00:00:00
drop table t1;
CREATE TABLE t1 ( a timestamp PRIMARY KEY );
INSERT INTO t1 VALUES ('2021-12-31'),('2022-01-03 01:00:00.00000'),(20220102);
update t1 set a=a*1/1+1 WHERE t1.a>20220102 ORDER BY t1.a LIMIT 1;
SELECT * FROM t1;
a
2021-12-31 00:00:00
2022-01-02 00:00:00
2022-01-03 01:00:01
drop table if exists t1;
drop table if exists t2;
drop table if exists t3;
CREATE TABLE t1 (a timestamp not null,b timestamp(4) not null, primary key (a));
CREATE TABLE t2 (a timestamp not null,b timestamp(4) not null, primary key (a));
CREATE TABLE t3 (a timestamp not null,b timestamp(4) not null, primary key (a));
insert into t1 values ('2022-01-01 00:00:00','2022-01-01 00:00:00'),(20220102,'2022-01-01 00:00:00'),(20220104,'2022-01-03 01:00:00.00000');
insert into t2 values ('2022-01-01 00:00:00','2022-01-01 00:00:00'),(20220102,'2022-01-02'),(20220103,'2022-01-03 01:00:00.00000');
insert into t3 values ('2022-01-01 00:00:00','2022-01-01 00:00:00'),(20220102,'2022-01-01 00:00:00'),(20220104,'2022-01-03 01:00:00.00000');
update t1 join t2 on t1.a=t2.a join t3 on t1.b=t3.b set t1.a=((t3.a*5) DIV 5) where t1.a=t2.a AND t2.b=t3.a and t1.b=t3.b;
select * from t1;
a	b
2022-01-01 00:00:00	2022-01-01 00:00:00.0000
2022-01-02 00:00:00	2022-01-01 00:00:00.0000
2022-01-04 00:00:00	2022-01-03 01:00:00.0000
drop table t1;
create table t1(a timestamp not null);
insert into t1 values ('2021-12-31');
update t1 set a=a+(a MOD 2) where a is null;
select * from t1;
a
2021-12-31 00:00:00
drop table if exists t1;
drop table if exists t2;
CREATE TABLE t1 (
a timestamp
);
CREATE TABLE t2 (
a timestamp
);
insert into t1 values('2022-01-01 00:00:00'),(20220102),('2022-01-03 01:00:00.00000'),('2022-01-04'),(20220105);
insert into t2 values('2022-01-01 00:00:00'),('2022-01-03 01:00:00.00000'),(20220105),('2022-01-07'),('2022-01-09 22:22:22');
update t1 join t2 alias on t1.a=alias.a set alias.a=t1.a+3 WHERE t1.a = alias.a;
drop table if exists t1;
drop table if exists t2;
create table t1 (id int,dd timestamp,dt timestamp);
insert into t1 values(1,'2022-04-28','2022-04-28 22:40:11');
insert into t1 values(2,'2022-04-28','2022-04-28 22:40:11');
insert into t1 values(3,'2022-04-28','2022-04-28 22:40:11');
insert into t1 values(4,'2022-04-28','2022-04-28 22:40:11');
insert into t1 values(5,'2022-04-28','2022-04-28 22:40:11');
update t1 sub set sub.dd=sub.dd+1 where id > 4;
select * from t1 where id>4;
id	dd	dt
5	2022-04-28 00:00:01	2022-04-28 22:40:11
drop table if exists t1;
create table t1 (id int,dd timestamp,dt timestamp);
insert into t1 values(1,'2022-04-28','2022-04-28 22:40:11');
insert into t1 values(2,'2022-04-28','2022-04-28 22:40:11');
insert into t1 values(3,'2022-04-28','2022-04-28 22:40:11');
insert into t1 values(4,'2022-04-28','2022-04-28 22:40:11');
insert into t1 values(5,'2022-04-28','2022-04-28 22:40:11');
update t1 sub set sub.dt=sub.dt+sub.id where id < 2 || id > 4;
select * from t1 order by dd-dt;
id	dd	dt
5	2022-04-28 00:00:00	2022-04-28 22:40:16
1	2022-04-28 00:00:00	2022-04-28 22:40:12
2	2022-04-28 00:00:00	2022-04-28 22:40:11
3	2022-04-28 00:00:00	2022-04-28 22:40:11
4	2022-04-28 00:00:00	2022-04-28 22:40:11
drop table if exists t1;
drop table if exists t2;
drop table if exists t3;
drop table if exists t4;
create table t1 (a timestamp);
create table t2 (a timestamp, b int);
create table t3 (a timestamp);
create table t4 (a timestamp primary key, b int not null);
insert into t1 values (20220102);
insert into t2 values ('2022-01-01 00:00:00',7);
insert into t4 values (20220104,8),('2022-01-03 01:00:00.00000',8),('2022-01-05',9);
insert into t3 values ('2022-01-03 01:00:00.00000'),(20220105);
update t3,t2,t1 set t2.a=t3.a where t3.a in (select a from t4 where b > 8);
select * from t1;
a
2022-01-02 00:00:00
select * from t2;
a	b
2022-01-05 00:00:00	7
drop table if exists t1;
drop table if exists t2;
drop table if exists t3;
drop table if exists t11;
drop table if exists t12;
CREATE TABLE t1 (a timestamp, b int primary key);
INSERT INTO t1 VALUES ('2022-01-01 00:00:00',1),('2022-01-01 00:00:00',2);
delete from t1 where a='2022-01-01 00:00:00' limit 1;
select * from t1;
a	b
2022-01-01 00:00:00	2
INSERT INTO t1 VALUES ('2022-01-01 00:00:00',3);
delete from t1 where a='2022-01-01';
select * from t1;
a	b
drop table t1;
create table t1 (
a timestamp primary key,
b timestamp(4) not null default '2000-01-01 00:00:00');
insert into t1 (a) values ('2022-01-02'),('2022-01-04'),('2022-01-06'),('2022-01-08'),('2022-01-10 01:01:01.000'),('2022-01-12');
delete from t1 where a=20220101+3;
select a,b from t1;
a	b
2022-01-02 00:00:00	2000-01-01 00:00:00.0000
2022-01-06 00:00:00	2000-01-01 00:00:00.0000
2022-01-08 00:00:00	2000-01-01 00:00:00.0000
2022-01-10 01:01:01	2000-01-01 00:00:00.0000
2022-01-12 00:00:00	2000-01-01 00:00:00.0000
delete from t1 where  3 < 2;
select a,b from t1;
a	b
2022-01-02 00:00:00	2000-01-01 00:00:00.0000
2022-01-06 00:00:00	2000-01-01 00:00:00.0000
2022-01-08 00:00:00	2000-01-01 00:00:00.0000
2022-01-10 01:01:01	2000-01-01 00:00:00.0000
2022-01-12 00:00:00	2000-01-01 00:00:00.0000
delete from t1 where  1 < 2;
select a,b from t1;
a	b
drop table t1;
create table t1 (a timestamp primary key, b char(32));
insert into t1 values (20220101,'apple'),('2022-01-02 00:00:00','apple');
select * from t1;
a	b
2022-01-01 00:00:00	apple
2022-01-02 00:00:00	apple
delete t1 from t1,t1 as t2 where t1.b = t2.b and t1.a > t2.a;
select * from t1;
a	b
2022-01-01 00:00:00	apple
drop table t1;
create table t11 (a timestamp(6) NOT NULL, b int, primary key (a));
create table t12 (a timestamp(6) NOT NULL, b int, primary key (a));
create table t2 (a timestamp(6) NOT NULL, b int, primary key (a));
insert into t11 values (20211231, 10),('2022-01-01 00:00:00', 11),('2022-01-02', 12);
insert into t12 values (20220303, 10),('2021-12-31', 11),(20220102, 12);
insert into t2 values ('2021-12-31', 21),('2022-01-01 00:00:00', 12),('2022-03-03', 23);
delete from t11 where t11.b <> (select b from t2 where t11.a = t2.a);
select * from t11;
a	b
2022-01-02 00:00:00.000000	12
delete t11,t12 from t11,t12 where t11.b <> (select b from t2 where t11.a = t2.a) or t12.a>20220101;
select * from t11;
a	b
select * from t12;
a	b
2021-12-31 00:00:00.000000	11
drop table if exists t1;
drop table if exists t2;
CREATE TABLE t1(a timestamp PRIMARY KEY);
INSERT INTO t1 VALUES('2022-10-01'),(20220220);
CREATE TABLE t2(b timestamp(4));
INSERT INTO t2 VALUES('2022-10-01 00:00:00.0001'),(20220220);
delete t1,t2 from t1 JOIN t2 on t1.a=t2.b WHERE t1.a=20221001;
select * from t1;
a
2022-02-20 00:00:00
2022-10-01 00:00:00
select * from t2;
b
2022-10-01 00:00:00.0001
2022-02-20 00:00:00.0000
drop table if exists t1;
drop table if exists t2;
drop table if exists t3;
CREATE TABLE t1 (a timestamp not null,b timestamp(4) not null, primary key (a));
CREATE TABLE t2 (a timestamp not null,b timestamp(4) not null, primary key (a));
CREATE TABLE t3 (a timestamp not null,b timestamp(4) not null, primary key (a));
insert into t1 values ('2022-01-01 00:00:00','2022-01-01 00:00:00'),(20220102,'2022-01-01 00:00:00'),(20220104,'2022-01-03 01:00:00.00000');
insert into t2 values ('2022-01-01 00:00:00','2022-01-01 00:00:00'),(20220102,'2022-01-02'),(20220103,'2022-01-03 01:00:00.00000');
insert into t3 values ('2022-01-01 00:00:00','2022-01-01 00:00:00'),(20220102,'2022-01-01 00:00:00'),(20220104,'2022-01-03 01:00:00.00000');
delete t1,t2,t3 from t1 join t2 on t1.a=t2.a join t3 on t1.b=t3.b where t1.a=t2.a AND t2.b=t3.a and t1.b=t3.b;
select * from t1;
a	b
2022-01-04 00:00:00	2022-01-03 01:00:00.0000
drop table t1;
create table t1(a timestamp not null);
insert into t1 values ('2021-12-31');
delete t1 from t1 where a is null;
select * from t1;
a
2021-12-31 00:00:00
drop table if exists t1;
drop table if exists t2;
CREATE TABLE t1 (
a timestamp
);
CREATE TABLE t2 (
a timestamp(6)
);
insert into t1 values('2022-01-01 00:00:00'),(20220102),('2022-01-03 01:00:00.00000'),('2022-01-04'),(20220105);
insert into t2 values('2022-01-01 00:00:00'),('2022-01-03 01:00:00.00000'),(20220105),('2022-01-07'),('2022-01-09 22:22:22');
delete alias from t1 join t2 alias on t1.a=alias.a WHERE t1.a = alias.a;
select * from t2;
a
2022-01-07 00:00:00.000000
2022-01-09 22:22:22.000000
drop table t1;
create table t1 (id int,dd timestamp,dt timestamp);
insert into t1 values(1,'2022-04-28','2022-04-28 22:40:11');
insert into t1 values(2,'2022-04-28','2022-04-28 22:40:11');
insert into t1 values(3,'2022-04-28','2022-04-28 22:40:11');
insert into t1 values(4,'2022-04-28','2022-04-28 22:40:11');
insert into t1 values(5,'2022-04-28','2022-04-28 22:40:11');
delete from t1 where id < 4 || id > 5;
select * from t1;
id	dd	dt
4	2022-04-28 00:00:00	2022-04-28 22:40:11
5	2022-04-28 00:00:00	2022-04-28 22:40:11
drop table if exists t1;
drop table if exists t2;
drop table if exists t3;
drop table if exists t4;
create table t1 (a timestamp);
create table t2 (a timestamp, b int);
create table t3 (a timestamp);
create table t4 (a timestamp primary key, b int not null);
insert into t1 values (20220102);
insert into t2 values ('2022-01-01 00:00:00',7);
insert into t4 values (20220104,8),('2022-01-03 01:00:00.00000',8),('2022-01-05',9);
insert into t3 values ('2022-01-03 01:00:00.00000'),(20220105);
delete t3 from t3,t4  where t3.a in (select a from t4 where b > 8);
select * from t3;
a
2022-01-03 01:00:00
drop table if exists t1;
drop table if exists t2;
drop table if exists t3;
drop table if exists t21;
drop table if exists t12;
CREATE TABLE t1 (a timestamp, b int primary key);
INSERT INTO t1 VALUES ('2022-01-01 00:00:00',1),('2022-01-01 00:00:00',2);
update t1 set a='2022-01-02' where a='2022-01-01 00:00:00' limit 1;
select * from t1;
a	b
2022-01-02 00:00:00	1
2022-01-01 00:00:00	2
INSERT INTO t1 VALUES ('2022-01-01 00:00:00',3);
update t1 set a='2022-01-02' where a='2022-01-01 00:00:00';
select * from t1;
a	b
2022-01-02 00:00:00	1
2022-01-02 00:00:00	2
2022-01-02 00:00:00	3
drop table t1;
create table t1 (
a timestamp primary key,
b timestamp(4) not null default '2000-01-01 00:00:00'
);
insert into t1 (a) values ('2022-01-02'),('2022-01-04'),('2022-01-06'),('2022-01-08'),('2022-01-10 01:01:01.000'),('2022-01-12');
update t1 set a=a+101;
select a,b from t1;
a	b
2022-01-02 00:01:01	2000-01-01 00:00:00.0000
2022-01-04 00:01:01	2000-01-01 00:00:00.0000
2022-01-06 00:01:01	2000-01-01 00:00:00.0000
2022-01-08 00:01:01	2000-01-01 00:00:00.0000
2022-01-10 01:02:02	2000-01-01 00:00:00.0000
2022-01-12 00:01:01	2000-01-01 00:00:00.0000
update t1 set a='2022-01-27 12:12:12.0001' where a='2022-01-08 00:01:01';
select a,b from t1;
a	b
2022-01-02 00:01:01	2000-01-01 00:00:00.0000
2022-01-04 00:01:01	2000-01-01 00:00:00.0000
2022-01-06 00:01:01	2000-01-01 00:00:00.0000
2022-01-27 12:12:12	2000-01-01 00:00:00.0000
2022-01-10 01:02:02	2000-01-01 00:00:00.0000
2022-01-12 00:01:01	2000-01-01 00:00:00.0000
update t1 set a=a-1 where 1 > 2;
select a,b from t1;
a	b
2022-01-02 00:01:01	2000-01-01 00:00:00.0000
2022-01-04 00:01:01	2000-01-01 00:00:00.0000
2022-01-06 00:01:01	2000-01-01 00:00:00.0000
2022-01-27 12:12:12	2000-01-01 00:00:00.0000
2022-01-10 01:02:02	2000-01-01 00:00:00.0000
2022-01-12 00:01:01	2000-01-01 00:00:00.0000
update t1 set a=a-1 where 3 > 2;
select a,b from t1;
a	b
2022-01-02 00:01:00	2000-01-01 00:00:00.0000
2022-01-04 00:01:00	2000-01-01 00:00:00.0000
2022-01-06 00:01:00	2000-01-01 00:00:00.0000
2022-01-27 12:12:11	2000-01-01 00:00:00.0000
2022-01-10 01:02:01	2000-01-01 00:00:00.0000
2022-01-12 00:01:00	2000-01-01 00:00:00.0000
drop table t1;
create table t1 (a timestamp primary key, b char(32));
insert into t1 values (20220101,'apple'),('2022-01-02','apple');
select * from t1;
a	b
2022-01-01 00:00:00	apple
2022-01-02 00:00:00	apple
update t1, t1 as t2 set t1.a=t1.a+1*5 where t1.b = t2.b and t1.a > t2.a;
select * from t1;
a	b
2022-01-01 00:00:00	apple
2022-01-02 00:00:05	apple
drop table if exists t11;
drop table if exists t12;
drop table if exists t2;
create table t11 (a timestamp(6) NOT NULL, b int, primary key (a));
create table t12 (a timestamp(6) NOT NULL, b int, primary key (a));
create table t2 (a timestamp(6) NOT NULL, b int, primary key (a));
insert into t11 values (20220103, 10),('2022-01-01 00:00:00', 11),('2022-01-02', 12);
insert into t12 values (20220303, 10),('2020-01-03 01:00:00.00000', 11),(20220102, 12);
insert into t2 values ('2021-12-31', 21),('2022-01-01 00:00:00', 12),('2022-03-03', 23);
select * from t11;
a	b
2022-01-01 00:00:00.000000	11
2022-01-02 00:00:00.000000	12
2022-01-03 00:00:00.000000	10
select * from t12;
a	b
2020-01-03 01:00:00.000000	11
2022-01-02 00:00:00.000000	12
2022-03-03 00:00:00.000000	10
update t11,t12 set t11.a=t11.a+t12.b where t12.a <> (select a from t2 where t11.a = t2.a);
select * from t11;
a	b
2022-01-01 00:00:11.000000	11
2022-01-02 00:00:00.000000	12
2022-01-03 00:00:00.000000	10
drop table if exists t1;
drop table if exists t2;
CREATE TABLE t1(a timestamp PRIMARY KEY);
INSERT INTO t1 VALUES('2022-10-01'),(20220220);
CREATE TABLE t2(b timestamp);
INSERT INTO t2 VALUES('2022-10-01'),(20220220);
update t1 JOIN t2 on t1.a=t2.b set t1.a='2022-05-05 01:01:01' WHERE t1.a=20221001;
select * from t1;
a
2022-02-20 00:00:00
2022-05-05 01:01:01
select * from t2;
b
2022-10-01 00:00:00
2022-02-20 00:00:00
drop table t1;
CREATE TABLE t1 ( a timestamp PRIMARY KEY );
INSERT INTO t1 VALUES ('2021-12-31'),('2022-01-03 01:00:00.00000'),(20220102);
update t1 set a=a*1/1+1 WHERE t1.a>20220102 ORDER BY t1.a LIMIT 1;
SELECT * FROM t1;
a
2021-12-31 00:00:00
2022-01-02 00:00:00
2022-01-03 01:00:01
drop table if exists t1;
drop table if exists t2;
drop table if exists t3;
CREATE TABLE t1 (a timestamp not null,b timestamp(4) not null, primary key (a));
CREATE TABLE t2 (a timestamp not null,b timestamp(4) not null, primary key (a));
CREATE TABLE t3 (a timestamp not null,b timestamp(4) not null, primary key (a));
insert into t1 values ('2022-01-01 00:00:00','2022-01-01 00:00:00'),(20220102,'2022-01-01 00:00:00'),(20220104,'2022-01-03 01:00:00.00000');
insert into t2 values ('2022-01-01 00:00:00','2022-01-01 00:00:00'),(20220102,'2022-01-02'),(20220103,'2022-01-03 01:00:00.00000');
insert into t3 values ('2022-01-01 00:00:00','2022-01-01 00:00:00'),(20220102,'2022-01-01 00:00:00'),(20220104,'2022-01-03 01:00:00.00000');
update t1 join t2 on t1.a=t2.a join t3 on t1.b=t3.b set t1.a=((t3.a*5) DIV 5) where t1.a=t2.a AND t2.b=t3.a and t1.b=t3.b;
select * from t1;
a	b
2022-01-01 00:00:00	2022-01-01 00:00:00.0000
2022-01-02 00:00:00	2022-01-01 00:00:00.0000
2022-01-04 00:00:00	2022-01-03 01:00:00.0000
drop table t1;
create table t1(a timestamp not null);
insert into t1 values ('2021-12-31');
update t1 set a=a+(a MOD 2) where a is null;
select * from t1;
a
2021-12-31 00:00:00
drop table if exists t1;
drop table if exists t2;
CREATE TABLE t1 (
a timestamp
);
CREATE TABLE t2 (
a timestamp
);
insert into t1 values('2022-01-01 00:00:00'),(20220102),('2022-01-03 01:00:00.00000'),('2022-01-04'),(20220105);
insert into t2 values('2022-01-01 00:00:00'),('2022-01-03 01:00:00.00000'),(20220105),('2022-01-07'),('2022-01-09 22:22:22');
update t1 join t2 alias on t1.a=alias.a set alias.a=t1.a*3 WHERE t1.a = alias.a;
drop table if exists t1;
drop table if exists t2;
create table t1 (id int,dd timestamp,dt timestamp);
insert into t1 values(1,'2022-04-28','2022-04-28 22:40:11');
insert into t1 values(2,'2022-04-28','2022-04-28 22:40:11');
insert into t1 values(3,'2022-04-28','2022-04-28 22:40:11');
insert into t1 values(4,'2022-04-28','2022-04-28 22:40:11');
insert into t1 values(5,'2022-04-28','2022-04-28 22:40:11');
update t1 sub set sub.dd=sub.dd+1 where id > 4;
select * from t1 where id>4;
id	dd	dt
5	2022-04-28 00:00:01	2022-04-28 22:40:11
drop table if exists t1;
create table t1 (id int,dd timestamp,dt timestamp);
insert into t1 values(1,'2022-04-28','2022-04-28 22:40:11');
insert into t1 values(2,'2022-04-28','2022-04-28 22:40:11');
insert into t1 values(3,'2022-04-28','2022-04-28 22:40:11');
insert into t1 values(4,'2022-04-28','2022-04-28 22:40:11');
insert into t1 values(5,'2022-04-28','2022-04-28 22:40:11');
update t1 sub set sub.dt=sub.dt+sub.id where id < 2 || id > 4;
select * from t1;
id	dd	dt
1	2022-04-28 00:00:00	2022-04-28 22:40:12
2	2022-04-28 00:00:00	2022-04-28 22:40:11
3	2022-04-28 00:00:00	2022-04-28 22:40:11
4	2022-04-28 00:00:00	2022-04-28 22:40:11
5	2022-04-28 00:00:00	2022-04-28 22:40:16
drop table if exists t1;
drop table if exists t2;
drop table if exists t3;
drop table if exists t4;
create table t1 (a timestamp);
create table t2 (a timestamp, b int);
create table t3 (a timestamp);
create table t4 (a timestamp primary key, b int not null);
insert into t1 values (20220102);
insert into t2 values ('2022-01-01 00:00:00',7);
insert into t4 values (20220104,8),('2022-01-03 01:00:00.00000',8),('2022-01-05',9);
insert into t3 values ('2022-01-03 01:00:00.00000'),(20220105);
update t3,t2,t1 set t2.a=t3.a where t3.a in (select a from t4 where b > 8);
select * from t1;
a
2022-01-02 00:00:00
select * from t2;
a	b
2022-01-05 00:00:00	7
drop table if exists t1;
drop table if exists t2;
drop table if exists t3;
drop table if exists t11;
drop table if exists t12;
CREATE TABLE t1 (a timestamp, b int primary key);
INSERT INTO t1 VALUES ('2022-01-01 00:00:00',1),('2022-01-01 00:00:00',2);
delete from t1 where a='2022-01-01 00:00:00' limit 1;
select * from t1;
a	b
2022-01-01 00:00:00	2
INSERT INTO t1 VALUES ('2022-01-01 00:00:00',3);
delete from t1 where a='2022-01-01';
select * from t1;
a	b
drop table t1;
create table t1 (
a timestamp primary key,
b timestamp(4) not null default '2000-01-01 00:00:00');
insert into t1 (a) values ('2022-01-02'),('2022-01-04'),('2022-01-06'),('2022-01-08'),('2022-01-10 01:01:01.000'),('2022-01-12');
delete from t1 where a=20220101+3;
select a,b from t1;
a	b
2022-01-02 00:00:00	2000-01-01 00:00:00.0000
2022-01-06 00:00:00	2000-01-01 00:00:00.0000
2022-01-08 00:00:00	2000-01-01 00:00:00.0000
2022-01-10 01:01:01	2000-01-01 00:00:00.0000
2022-01-12 00:00:00	2000-01-01 00:00:00.0000
delete from t1 where  3 < 2;
select a,b from t1;
a	b
2022-01-02 00:00:00	2000-01-01 00:00:00.0000
2022-01-06 00:00:00	2000-01-01 00:00:00.0000
2022-01-08 00:00:00	2000-01-01 00:00:00.0000
2022-01-10 01:01:01	2000-01-01 00:00:00.0000
2022-01-12 00:00:00	2000-01-01 00:00:00.0000
delete from t1 where  1 < 2;
select a,b from t1;
a	b
drop table t1;
create table t1 (a timestamp primary key, b char(32));
insert into t1 values (20220101,'apple'),('2022-01-02 00:00:00','apple');
select * from t1;
a	b
2022-01-01 00:00:00	apple
2022-01-02 00:00:00	apple
delete t1 from t1,t1 as t2 where t1.b = t2.b and t1.a > t2.a;
select * from t1;
a	b
2022-01-01 00:00:00	apple
drop table t1;
create table t11 (a timestamp(6) NOT NULL, b int, primary key (a));
create table t12 (a timestamp(6) NOT NULL, b int, primary key (a));
create table t2 (a timestamp(6) NOT NULL, b int, primary key (a));
insert into t11 values (20211231, 10),('2022-01-01 00:00:00', 11),('2022-01-02', 12);
insert into t12 values (20220303, 10),('2021-12-31', 11),(20220102, 12);
insert into t2 values ('2021-12-31', 21),('2022-01-01 00:00:00', 12),('2022-03-03', 23);
delete from t11 where t11.b <> (select b from t2 where t11.a = t2.a);
select * from t11;
a	b
2022-01-02 00:00:00.000000	12
delete t11,t12 from t11,t12 where t11.b <> (select b from t2 where t11.a = t2.a) or t12.a>20220101;
select * from t11;
a	b
select * from t12;
a	b
2021-12-31 00:00:00.000000	11
drop table if exists t1;
drop table if exists t2;
CREATE TABLE t1(a timestamp PRIMARY KEY);
INSERT INTO t1 VALUES('2022-10-01'),(20220220);
CREATE TABLE t2(b timestamp(4));
INSERT INTO t2 VALUES('2022-10-01 00:00:00.0001'),(20220220);
delete t1,t2 from t1 JOIN t2 on t1.a=t2.b WHERE t1.a=20221001;
select * from t1;
a
2022-02-20 00:00:00
2022-10-01 00:00:00
select * from t2;
b
2022-10-01 00:00:00.0001
2022-02-20 00:00:00.0000
drop table if exists t1;
drop table if exists t2;
drop table if exists t3;
CREATE TABLE t1 (a timestamp not null,b timestamp(4) not null, primary key (a));
CREATE TABLE t2 (a timestamp not null,b timestamp(4) not null, primary key (a));
CREATE TABLE t3 (a timestamp not null,b timestamp(4) not null, primary key (a));
insert into t1 values ('2022-01-01 00:00:00','2022-01-01 00:00:00'),(20220102,'2022-01-01 00:00:00'),(20220104,'2022-01-03 01:00:00.00000');
insert into t2 values ('2022-01-01 00:00:00','2022-01-01 00:00:00'),(20220102,'2022-01-02'),(20220103,'2022-01-03 01:00:00.00000');
insert into t3 values ('2022-01-01 00:00:00','2022-01-01 00:00:00'),(20220102,'2022-01-01 00:00:00'),(20220104,'2022-01-03 01:00:00.00000');
delete t1,t2,t3 from t1 join t2 on t1.a=t2.a join t3 on t1.b=t3.b where t1.a=t2.a AND t2.b=t3.a and t1.b=t3.b;
select * from t1;
a	b
2022-01-04 00:00:00	2022-01-03 01:00:00.0000
drop table t1;
create table t1(a timestamp not null);
insert into t1 values ('2021-12-31');
delete t1 from t1 where a is null;
select * from t1;
a
2021-12-31 00:00:00
drop table if exists t1;
drop table if exists t2;
CREATE TABLE t1 (
a timestamp
);
CREATE TABLE t2 (
a timestamp(6)
);
insert into t1 values('2022-01-01 00:00:00'),(20220102),('2022-01-03 01:00:00.00000'),('2022-01-04'),(20220105);
insert into t2 values('2022-01-01 00:00:00'),('2022-01-03 01:00:00.00000'),(20220105),('2022-01-07'),('2022-01-09 22:22:22');
delete alias from t1 join t2 alias on t1.a=alias.a WHERE t1.a = alias.a;
select * from t2;
a
2022-01-07 00:00:00.000000
2022-01-09 22:22:22.000000
drop table t1;
create table t1 (id int,dd timestamp,dt timestamp);
insert into t1 values(1,'2022-04-28','2022-04-28 22:40:11');
insert into t1 values(2,'2022-04-28','2022-04-28 22:40:11');
insert into t1 values(3,'2022-04-28','2022-04-28 22:40:11');
insert into t1 values(4,'2022-04-28','2022-04-28 22:40:11');
insert into t1 values(5,'2022-04-28','2022-04-28 22:40:11');
delete from t1 where id < 4 || id > 5;
select * from t1;
id	dd	dt
4	2022-04-28 00:00:00	2022-04-28 22:40:11
5	2022-04-28 00:00:00	2022-04-28 22:40:11
drop table if exists t1;
drop table if exists t2;
drop table if exists t3;
drop table if exists t4;
create table t1 (a timestamp);
create table t2 (a timestamp, b int);
create table t3 (a timestamp);
create table t4 (a timestamp primary key, b int not null);
insert into t1 values (20220102);
insert into t2 values ('2022-01-01 00:00:00',7);
insert into t4 values (20220104,8),('2022-01-03 01:00:00.00000',8),('2022-01-05',9);
insert into t3 values ('2022-01-03 01:00:00.00000'),(20220105);
delete t3 from t3,t4  where t3.a in (select a from t4 where b > 8);
select * from t3;
a
2022-01-03 01:00:00
