create table t1 (a tinyint unsigned not null, primary key(a));
insert into t1 values (255), (0xFC), (254), (253);
select * from t1;
a
252
253
254
255
select * from t1 where a=255;
a
255
delete from t1 where a=255;
select * from t1;
a
252
253
254
drop table t1;
create table t1 ( a tinyint not null default 1, tinyint8 tinyint primary key);
insert into t1 (tinyint8) values (-1),(127),(-128);
select * from t1;
a	tinyint8
1	-128
1	-1
1	127
select min(tinyint8),max(tinyint8),max(tinyint8)-1 from t1;
min(tinyint8)	max(tinyint8)	max(tinyint8)-1
-128	127	126
select min(tinyint8),max(tinyint8),max(tinyint8)-1 from t1 group by a;
min(tinyint8)	max(tinyint8)	max(tinyint8)-1
-128	127	126
drop table t1;
create table t1 ( a tinyint not null default 1, tinyint8 tinyint unsigned primary key);
insert into t1 (tinyint8) values (0),(255), (0xFE), (253);
select * from t1;
a	tinyint8
1	0
1	253
1	254
1	255
select * from t1 order by tinyint8 limit 1,3;
a	tinyint8
1	253
1	254
1	255
select * from t1 order by tinyint8 limit 3 offset 1;
a	tinyint8
1	253
1	254
1	255
select min(tinyint8),max(tinyint8),max(tinyint8)-1 from t1;
min(tinyint8)	max(tinyint8)	max(tinyint8)-1
0	255	254
select min(tinyint8),max(tinyint8),max(tinyint8)-1 from t1 group by a;
min(tinyint8)	max(tinyint8)	max(tinyint8)-1
0	255	254
drop table t1;
create table t1 (id tinyint primary key, a tinyint);
insert into t1 values (1,1);
select * from t1;
id	a
1	1
select * from t1 limit 99;
id	a
1	1
drop table if exists t1;
drop table if exists t2;
create table t1 (
valueu8  tinyint unsigned  not null,
value8  tinyint			 not null,
primary key(value8)
);
create table t2 (
valueu8  tinyint unsigned  not null,
value8  tinyint			 not null,
primary key(value8)
);
insert into t1 values(255, 1);
insert into t1 values( 127, 2);
insert into t2 values(255, 3);
insert into t2 values( 127, 4);
insert into t1 values(5,-128);
insert into t2 values(5,-128);
select * from t1;
valueu8	value8
5	-128
255	1
127	2
select * from t2;
valueu8	value8
5	-128
255	3
127	4
select * from t1 join t2 on t1.valueu8=t2.valueu8  order by 1 asc, t2.value8 desc;
valueu8	value8	valueu8	value8
5	-128	5	-128
127	2	127	4
255	1	255	3
select * from t1 join t2 on t1.valueu8=t2.valueu8 where t1.valueu8=255;
valueu8	value8	valueu8	value8
255	1	255	3
select * from t1 join t2 on t1.value8=t2.value8 order by 2;
valueu8	value8	valueu8	value8
5	-128	5	-128
drop table if exists t1;
drop table if exists t2;
create table t1 (tinyint8 tinyint not null);
insert into t1 values (-128);
select * from t1;
tinyint8
-128
drop table t1;
create table t1 (tinyint_col tinyint unsigned);
insert into t1 values (250);
select * from t1 where tinyint_col=250;
tinyint_col
250
select * from t1 where tinyint_col='250';
tinyint_col
250
drop table t1;
select cast(250 as unsigned) mod 50 as result;
result
0
select cast(127 as signed);
cast(127 as signed)
127
select cast(-128 as signed);
cast(-128 as signed)
-128
CREATE TABLE t1 (id TINYINT PRIMARY KEY,
a TINYINT(4) UNSIGNED,
b VARCHAR(4));
INSERT INTO t1 (id,a) VALUES
(1,0),
(2,CAST(0x7F AS UNSIGNED)),
(3,CAST(0x80 AS UNSIGNED)),
(4,CAST(0xFF AS UNSIGNED));
UPDATE t1 SET b = a;
select * from t1 where ((a = 255) and (b = '255')) order by 1 desc, 2 asc;
id	a	b
4	255	255
CREATE TABLE t_tinyint(id TINYINT);
INSERT INTO t_tinyint VALUES (1), (2);
SELECT id, id >= 1.1 FROM t_tinyint;
id	id >= 1.1
1	false	
2	true	
SELECT id, 1.1 <= id FROM t_tinyint;
id	1.1 <= id
1	false	
2	true	
SELECT id, id = 1.1 FROM t_tinyint;
id	id = 1.1
1	false	
2	false	
SELECT id, 1.1 = id FROM t_tinyint;
id	1.1 = id
1	false	
2	false	
SELECT * from t_tinyint WHERE id = 1.1;
id
SELECT * from t_tinyint WHERE id = 1.1e0;
id
SELECT * from t_tinyint WHERE id = '1.1';
id
SELECT * from t_tinyint WHERE id = '1.1e0';
id
SELECT * from t_tinyint WHERE id IN (1.1, 2.2);
id
SELECT * from t_tinyint WHERE id IN (1.1e0, 2.2e0);
id
SELECT * from t_tinyint WHERE id IN ('1.1', '2.2');
id
SELECT * from t_tinyint WHERE id IN ('1.1e0', '2.2e0');
id
SELECT * from t_tinyint WHERE id BETWEEN 1.1 AND 1.9;
id
SELECT * from t_tinyint WHERE id BETWEEN 1.1e0 AND 1.9e0;
id
SELECT * from t_tinyint WHERE id BETWEEN '1.1' AND '1.9';
id
SELECT * from t_tinyint WHERE id BETWEEN '1.1e0' AND '1.9e0';
id
drop table t1;
CREATE TABLE t1 (a TINYINT);
INSERT INTO t1 VALUES (1);
SELECT * FROM t1 WHERE coalesce(a) BETWEEN 0 and 0.9;
a
SELECT * FROM t1 WHERE coalesce(a)=0.9;
a
SELECT * FROM t1 WHERE coalesce(a) in (0.8,0.9);
a
SELECT * FROM t1 WHERE a BETWEEN 0 AND 0.9;
a
SELECT * FROM t1 WHERE a=0.9;
a
SELECT * FROM t1 WHERE a IN (0.8,0.9) order by 1;
a
drop table t1;
create table t (id tinyint unsigned, b tinyint);
insert into t values(127,1);
insert into t values(255,2);
insert into t values(128,3);
select count(*) from t
where id>=127 and id <=255 order by 1;
count(*)
3
select count(*) from t
where id between 127 and 255;
count(*)
3
drop table t;
SELECT (254 BETWEEN 0 AND 255);
(254 BETWEEN 0 AND 255)
true
SELECT  -32000 <= 0;
-32000 <= 0
true
SELECT 0 <= 127;
0 <= 127
ture
SELECT CAST(100 AS UNSIGNED) BETWEEN 1 AND -1;
CAST(100 AS UNSIGNED) BETWEEN 1 AND -1
false
SELECT CAST(100 AS UNSIGNED) NOT BETWEEN 1 AND -1;
CAST(100 AS UNSIGNED) NOT BETWEEN 1 AND -1
true
SELECT CAST(0 AS UNSIGNED) BETWEEN 0 AND -1;
CAST(0 AS UNSIGNED) BETWEEN 0 AND -1
false
SELECT CAST(0 AS UNSIGNED) NOT BETWEEN 0 AND -1;
CAST(0 AS UNSIGNED) NOT BETWEEN 0 AND -1
true
SELECT ( 255 BETWEEN 255 AND 255 );
( 255 BETWEEN 255 AND 255 )
true
SELECT ( 127 BETWEEN 255 AND 1 );
( 127 BETWEEN 255 AND 1 )
false
SELECT ( -1 BETWEEN 255 AND 1 );
( -1 BETWEEN 255 AND 1 )
false
SELECT ( 0 BETWEEN 255 AND 1 );
( 0 BETWEEN 255 AND 1 )
false
SELECT ( 1 BETWEEN 255 AND 1 );
( 1 BETWEEN 255 AND 1 )
false
drop table if exists t1;
drop table if exists t2;
drop table if exists t3;
drop table if exists t11;
drop table if exists t12;
CREATE TABLE t1 (a tinyint(3), b tinyint(5) primary key);
INSERT INTO t1 VALUES (1,1),(1,2);
update t1 set a=2 where a=1 limit 1;
select * from t1;
a	b
2	1
1	2
INSERT INTO t1 VALUES (1,3);
update t1 set a=2 where a=1;
select * from t1;
a	b
2	1
2	2
2	3
drop table t1;
create table t1 (
a tinyint not null,
b tinyint not null default 0,
c tinyint not null default 0,
d tinyint not null default 0,
e tinyint not null default 0,
f tinyint not null default 0,
g tinyint not null default 0,
h tinyint not null default 0,
i tinyint not null default 0,
j tinyint not null default 0,
primary key (a));
insert into t1 (a) values (2),(4),(6),(8),(10),(12),(14),(16),(18),(20),(22),(24),(26),(23);
update t1 set a=a+101;
select a,b from t1;
a	b
103	0
105	0
107	0
109	0
111	0
113	0
115	0
117	0
119	0
121	0
123	0
124	0
125	0
127	0
update t1 set a=127 where a=25;
select a,b from t1;
a	b
103	0
105	0
107	0
109	0
111	0
113	0
115	0
117	0
119	0
121	0
123	0
124	0
125	0
127	0
update t1 set a=a-1 where 1 > 2;
select a,b from t1;
a	b
103	0
105	0
107	0
109	0
111	0
113	0
115	0
117	0
119	0
121	0
123	0
124	0
125	0
127	0
update t1 set a=a-1 where 3 > 2;
select a,b from t1;
a	b
102	0
104	0
106	0
108	0
110	0
112	0
114	0
116	0
118	0
120	0
122	0
123	0
124	0
126	0
drop table t1;
create table t1 (a tinyint primary key, b char(32));
insert into t1 values (1,'apple'), (2,'apple');
select * from t1;
a	b
1	apple
2	apple
update t1, t1 as t2 set t1.a=t1.a*2 where t1.b = t2.b and t1.a > t2.a;
select * from t1;
a	b
1	apple
4	apple
drop table t1;
create table t11 (a tinyint NOT NULL, b int, primary key (a));
create table t12 (a tinyint NOT NULL, b int, primary key (a));
create table t2 (a tinyint NOT NULL, b int, primary key (a));
insert into t11 values (0, 10),(1, 11),(2, 12);
insert into t12 values (33, 10),(0, 11),(2, 12);
insert into t2 values (0, 21),(1, 12),(3, 23);
update t12 join t11 on t11.a = t12.a set t11.a=t12.a where t11.b <> (select b from t2 where t11.a = t2.a);
select * from t11;
a	b
0	10
1	11
2	12
select * from t12;
a	b
0	11
2	12
33	10
update t11,t12 set t11.a=t11.a+t11.b where t11.b <> (select b from t2 where t11.a = t2.a);
select * from t11;
a	b
2	12
10	10
12	11
drop table if exists t1;
drop table if exists t2;
CREATE TABLE t1(a tinyint PRIMARY KEY);
INSERT INTO t1 VALUES(10),(20);
CREATE TABLE t2(b tinyint);
INSERT INTO t2 VALUES(10),(20);
update t1 JOIN t2 on t1.a=t2.b set t1.a=5 WHERE t1.a = 10;
select * from t1;
a
5
20
select * from t2;
b
10
20
drop table t1;
CREATE TABLE t1 ( a tinyint PRIMARY KEY );
INSERT INTO t1 VALUES (0),(1),(2);
update t1 set a=a*10%3 WHERE t1.a > 0 ORDER BY t1.a LIMIT 1;
SELECT * FROM t1;
a
0
1
2
drop table if exists t1;
drop table if exists t2;
drop table if exists t3;
CREATE TABLE t1 (a tinyint not null,b tinyint not null, primary key (a));
CREATE TABLE t2 (a tinyint not null,b tinyint not null, primary key (a));
CREATE TABLE t3 (a tinyint not null,b tinyint not null, primary key (a));
insert into t1 values (1,1),(2,1),(4,3);
insert into t2 values (1,1),(2,2),(3,3);
insert into t3 values (1,1),(2,1),(4,3);
update t1 join t2 on t1.a=t2.a join t3 on t1.b=t3.b set t1.a=((t3.a*5) DIV 5) where t1.a=t2.a AND t2.b=t3.a and t1.b=t3.b;
select * from t1;
a	b
1	1
2	1
4	3
drop table t1;
create table t1(a tinyint not null);
insert into t1 values (0);
update t1 set a=a+(a MOD 2) where a is null;
select * from t1;
a
0
drop table if exists t1;
drop table if exists t2;
CREATE TABLE t1 (
a tinyint
);
CREATE TABLE t2 (
a tinyint
);
insert into t1 values(1),(2),(3),(4),(5);
insert into t2 values(1),(3),(5),(7),(9);
update t1 join t2 alias on t1.a=alias.a set alias.a=t1.a*3 WHERE t1.a = alias.a;
select * from t1;
a
1
2
3
4
5
drop table if exists t1;
drop table if exists t2;
create table t1 (id tinyint,ti tinyint unsigned,si tinyint,bi tinyint unsigned,fl float,dl double,de decimal,ch char(20),vch varchar(20),dd date,dt datetime);
insert into t1 values(1,1,4,3,1113.32,111332,1113.32,'hello','subquery','2022-04-28','2022-04-28 22:40:11');
insert into t1 values(2,2,5,2,2252.05,225205,2252.05,'bye','sub query','2022-04-28','2022-04-28 22:40:11');
insert into t1 values(3,6,6,3,3663.21,366321,3663.21,'hi','subquery','2022-04-28','2022-04-28 22:40:11');
insert into t1 values(4,7,1,5,4715.22,471522,4715.22,'good morning','my subquery','2022-04-28','2022-04-28 22:40:11');
insert into t1 values(5,1,2,6,51.26,5126,51.26,'byebye',' is subquery?','2022-04-28','2022-04-28 22:40:11');
insert into t1 values(6,3,2,1,632.1,6321,632.11,'good night','maybe subquery','2022-04-28','2022-04-28 22:40:11');
insert into t1 values(7,4,4,3,7443.11,744311,7443.11,'yes','subquery','2022-04-28','2022-04-28 22:40:11');
insert into t1 values(8,7,5,8,8758.00,875800,8758.11,'nice to meet','just subquery','2022-04-28','2022-04-28 22:40:11');
insert into t1 values(9,8,4,9,9849.312,9849312,9849.312,'see you','subquery','2022-04-28','2022-04-28 22:40:11');
update t1 sub set sub.id=id-99 where id > 4;
select count(*) from t1 where id>4;
count(*)
0
drop table if exists t1;
create table t1 (id tinyint,ti tinyint unsigned,si tinyint,bi tinyint unsigned,fl float,dl double,de decimal,ch char(20),vch varchar(20),dd date,dt datetime);
insert into t1 values(1,1,4,3,1113.32,111332,1113.32,'hello','subquery','2022-04-28','2022-04-28 22:40:11');
insert into t1 values(2,2,5,2,2252.05,225205,2252.05,'bye','sub query','2022-04-28','2022-04-28 22:40:11');
insert into t1 values(3,6,6,3,3663.21,366321,3663.21,'hi','subquery','2022-04-28','2022-04-28 22:40:11');
insert into t1 values(4,7,1,5,4715.22,471522,4715.22,'good morning','my subquery','2022-04-28','2022-04-28 22:40:11');
insert into t1 values(5,1,2,6,51.26,5126,51.26,'byebye',' is subquery?','2022-04-28','2022-04-28 22:40:11');
insert into t1 values(6,3,2,1,632.1,6321,632.11,'good night','maybe subquery','2022-04-28','2022-04-28 22:40:11');
insert into t1 values(7,4,4,3,7443.11,744311,7443.11,'yes','subquery','2022-04-28','2022-04-28 22:40:11');
insert into t1 values(8,7,5,8,8758.00,875800,8758.11,'nice to meet','just subquery','2022-04-28','2022-04-28 22:40:11');
insert into t1 values(9,8,4,9,9849.312,9849312,9849.312,'see you','subquery','2022-04-28','2022-04-28 22:40:11');
update t1 sub set sub.id=sub.id%4+sub.id where id < 4 || id > 5;
select * from t1 order by id+ti asc;
id	ti	si	bi	fl	dl	de	ch	vch	dd	dt
2	1	4	3	1113.32	111332	1113	hello	subquery	2022-04-28	2022-04-28 22:40:11
4	2	5	2	2252.05	225205	2252	bye	sub query	2022-04-28	2022-04-28 22:40:11
5	1	2	6	51.26	5126	51	byebye	 is subquery?	2022-04-28	2022-04-28 22:40:11
4	7	1	5	4715.22	471522	4715	good morning	my subquery	2022-04-28	2022-04-28 22:40:11
8	3	2	1	632.1	6321	632	good night	maybe subquery	2022-04-28	2022-04-28 22:40:11
6	6	6	3	3663.21	366321	3663	hi	subquery	2022-04-28	2022-04-28 22:40:11
10	4	4	3	7443.11	744311	7443	yes	subquery	2022-04-28	2022-04-28 22:40:11
8	7	5	8	8758	875800	8758	nice to meet	just subquery	2022-04-28	2022-04-28 22:40:11
10	8	4	9	9849.31	9849312	9849	see you	subquery	2022-04-28	2022-04-28 22:40:11
drop table if exists t1;
create table t1 (id tinyint,ti tinyint unsigned,si tinyint,bi tinyint unsigned,fl float,dl double,de decimal,ch char(20),vch varchar(20),dd date,dt datetime);
insert into t1 values(1,1,4,3,1113.32,111332,1113.32,'hello','subquery','2022-04-28','2022-04-28 22:40:11');
insert into t1 values(2,2,5,2,2252.05,225205,2252.05,'bye','sub query','2022-04-28','2022-04-28 22:40:11');
insert into t1 values(3,6,6,3,3663.21,366321,3663.21,'hi','subquery','2022-04-28','2022-04-28 22:40:11');
insert into t1 values(4,7,1,5,4715.22,471522,4715.22,'good morning','my subquery','2022-04-28','2022-04-28 22:40:11');
update t1,(select * from (select * from (select id,ti,si,de from (select * from t1 ) sub3 where fl <> 4.5 ) sub2 where ti > 1) sub1 where id >2 ) sub set t1.id=sub.id*10+t1.id where t1.id = 4;
select max(id) from t1;
max(id)
34
drop table if exists t1;
drop table if exists t2;
drop table if exists t3;
drop table if exists t4;
create table t1 (a tinyint);
create table t2 (a tinyint, b int);
create table t3 (a tinyint);
create table t4 (a tinyint not null, b int not null);
insert into t1 values (2);
insert into t2 values (1,7),(2,7);
insert into t4 values (4,8),(3,8),(5,9);
insert into t3 values (100),(8);
update t3,t2,t1 set t1.a=0 and t2.a=t2.a+t3.a where t3.a in (select b from t4 where b > 7);
select * from t1;
a
0
select * from t2;
a	b
1	7
2	7
drop table if exists t1;
drop table if exists t2;
drop table if exists t3;
drop table if exists t11;
drop table if exists t12;
CREATE TABLE t1 (a tinyint(3), b tinyint(5) primary key);
INSERT INTO t1 VALUES (1,1),(1,2);
delete from t1 where a=1 limit 1;
select * from t1;
a	b
1	2
INSERT INTO t1 VALUES (1,3);
delete from t1 where a=1;
select * from t1;
a	b
drop table t1;
create table t1 (
a tinyint not null,
b tinyint not null default 0,
c tinyint not null default 0,
d tinyint not null default 0,
e tinyint not null default 0,
f tinyint not null default 0,
g tinyint not null default 0,
h tinyint not null default 0,
i tinyint not null default 0,
j tinyint not null default 0,
primary key (a));
insert into t1 (a) values (2),(4),(6),(8),(10),(12),(14),(16),(18),(20),(22),(24),(26),(23);
delete from t1 where a=2+2;
select a,b from t1;
a	b
2	0
6	0
8	0
10	0
12	0
14	0
16	0
18	0
20	0
22	0
23	0
24	0
26	0
delete from t1 where  a=24;
select a,b from t1;
a	b
2	0
6	0
8	0
10	0
12	0
14	0
16	0
18	0
20	0
22	0
23	0
26	0
delete from t1 where  3 < 2;
select a,b from t1;
a	b
2	0
6	0
8	0
10	0
12	0
14	0
16	0
18	0
20	0
22	0
23	0
26	0
delete from t1 where  1 < 2;
select a,b from t1;
a	b
drop table t1;
create table t1 (a tinyint primary key, b char(32));
insert into t1 values (1,'apple'), (2,'apple');
select * from t1;
a	b
1	apple
2	apple
delete t1 from t1,t1 as t2 where t1.b = t2.b and t1.a > t2.a;
select * from t1;
a	b
1	apple
drop table t1;
create table t11 (a tinyint NOT NULL, b int, primary key (a));
create table t12 (a tinyint NOT NULL, b int, primary key (a));
create table t2 (a tinyint NOT NULL, b int, primary key (a));
insert into t11 values (0, 10),(1, 11),(2, 12);
insert into t12 values (33, 10),(0, 11),(2, 12);
insert into t2 values (0, 21),(1, 12),(3, 23);
delete from t11 where t11.b <> (select b from t2 where t11.a = t2.a);
select * from t11;
a	b
2	12
delete t11,t12 from t11,t12 where t11.b <> (select b from t2 where t11.a = t2.a) or t12.a>1;
select * from t11;
a	b
select * from t12;
a	b
0	11
drop table if exists t1;
drop table if exists t2;
CREATE TABLE t1(a tinyint PRIMARY KEY);
INSERT INTO t1 VALUES(10),(20);
CREATE TABLE t2(b tinyint);
INSERT INTO t2 VALUES(10),(20);
delete t1,t2 from t1 JOIN t2 on t1.a=t2.b WHERE t1.a = 10;
select * from t1;
a
20
select * from t2;
b
20
drop table if exists t1;
drop table if exists t2;
drop table if exists t3;
CREATE TABLE t1 (a tinyint not null,b tinyint not null, primary key (a));
CREATE TABLE t2 (a tinyint not null,b tinyint not null, primary key (a));
CREATE TABLE t3 (a tinyint not null,b tinyint not null, primary key (a));
insert into t1 values (1,1),(2,1),(4,3);
insert into t2 values (1,1),(2,2),(3,3);
insert into t3 values (1,1),(2,1),(4,3);
delete t1,t2,t3 from t1 join t2 on t1.a=t2.a join t3 on t1.b=t3.b where t1.a=t2.a AND t2.b=t3.a and t1.b=t3.b;
select * from t1;
a	b
4	3
drop table t1;
create table t1(a tinyint not null);
insert into t1 values (0);
delete t1 from t1 where a is null;
select * from t1;
a
0
drop table if exists t1;
drop table if exists t2;
CREATE TABLE t1 (
a tinyint
);
CREATE TABLE t2 (
a tinyint
);
insert into t1 values(1),(2),(3),(4),(5);
insert into t2 values(1),(3),(5),(7),(9);
delete alias from t1 join t2 alias on t1.a=alias.a+1 WHERE t1.a = alias.a;
select * from t2;
a
1
3
5
7
9
drop table if exists t1;
create table t1 (id tinyint,ti tinyint unsigned,si tinyint,bi tinyint unsigned,fl float,dl double,de decimal,ch char(20),vch varchar(20),dd date,dt datetime);
insert into t1 values(1,1,4,3,1113.32,111332,1113.32,'hello','subquery','2022-04-28','2022-04-28 22:40:11');
insert into t1 values(2,2,5,2,2252.05,225205,2252.05,'bye','sub query','2022-04-28','2022-04-28 22:40:11');
insert into t1 values(3,6,6,3,3663.21,366321,3663.21,'hi','subquery','2022-04-28','2022-04-28 22:40:11');
insert into t1 values(4,7,1,5,4715.22,471522,4715.22,'good morning','my subquery','2022-04-28','2022-04-28 22:40:11');
insert into t1 values(5,1,2,6,51.26,5126,51.26,'byebye',' is subquery?','2022-04-28','2022-04-28 22:40:11');
insert into t1 values(6,3,2,1,632.1,6321,632.11,'good night','maybe subquery','2022-04-28','2022-04-28 22:40:11');
insert into t1 values(7,4,4,3,7443.11,744311,7443.11,'yes','subquery','2022-04-28','2022-04-28 22:40:11');
insert into t1 values(8,7,5,8,8758.00,875800,8758.11,'nice to meet','just subquery','2022-04-28','2022-04-28 22:40:11');
insert into t1 values(9,8,4,9,9849.312,9849312,9849.312,'see you','subquery','2022-04-28','2022-04-28 22:40:11');
delete from t1 where id < 4 || id > 5;
select * from t1;
id	ti	si	bi	fl	dl	de	ch	vch	dd	dt
4	7	1	5	4715.22	471522	4715	good morning	my subquery	2022-04-28	2022-04-28 22:40:11
5	1	2	6	51.26	5126	51	byebye	 is subquery?	2022-04-28	2022-04-28 22:40:11
drop table if exists t1;
create table t1 (id tinyint,ti tinyint unsigned,si tinyint,bi tinyint unsigned,fl float,dl double,de decimal,ch char(20),vch varchar(20),dd date,dt datetime);
insert into t1 values(1,1,4,3,1113.32,111332,1113.32,'hello','subquery','2022-04-28','2022-04-28 22:40:11');
insert into t1 values(2,2,5,2,2252.05,225205,2252.05,'bye','sub query','2022-04-28','2022-04-28 22:40:11');
insert into t1 values(3,6,6,3,3663.21,366321,3663.21,'hi','subquery','2022-04-28','2022-04-28 22:40:11');
insert into t1 values(4,7,1,5,4715.22,471522,4715.22,'good morning','my subquery','2022-04-28','2022-04-28 22:40:11');
delete t1 from t1,((select * from (select * from (select id,ti,si,de from (select * from t1 ) sub3 where fl <> 4.5 ) sub2 where ti > 1) sub1 where id >2 )) sub2 where t1.id=sub2.id;
select id from t1;
id
1
2
drop table if exists t1;
drop table if exists t2;
drop table if exists t3;
drop table if exists t4;
create table t1 (a tinyint);
create table t2 (a tinyint, b int);
create table t3 (a tinyint);
create table t4 (a tinyint not null, b int not null);
insert into t1 values (2);
insert into t2 values (1,7),(2,7);
insert into t4 values (4,8),(3,8),(5,9);
insert into t3 values (100),(8);
delete t3 from t3,t4 where t3.a in (select b from t4 where b > 7);
select * from t3;
a
100
